slug,anchor_text_var_1,anchor_text_var_2,description,related_slug_to_link_1,related_slug_to_link_2
colors,AI Colors Flashcards,Colors Flashcard Generator,"Instantly generate vibrant colors flashcards from documents to accelerate visual learning.",shapes,maker
vowel,Vowel Flashcards from PDF,AI Vowel Concepts Generator,"Transform study materials into smart vowel flashcards for mastering phonetic concepts.",long-vowel,pdf-flashcards
maker-pictures,Flashcard Maker with Pictures,AI Visual Study Sets,"Automatically create engaging, visual study sets by adding pictures to flashcards.",picture,creator-images
create-quizlet,AI Quizlet Flashcard Creator,Automated Quizlet Deck Builder,"Ditch manual entry and create smarter Quizlet-style decks from documents instantly.",create-anki,sites-like-quizlet
digital-maker,AI Digital Flashcard Maker,Online Digital Study Decks,"Create intelligent digital flashcard decks from any file for modern studying.",online-maker,maker
anki-english,Anki English Flashcards,Auto-generate Anki English Vocab,"Automatically generate Anki decks for English vocabulary to optimize language acquisition.",english-vocabulary,create-anki
1-10,1-10 Counting Flashcards,Number Flashcards 1-10,"Generate counting flashcards from any PDF to master numbers 1 to 10.",counting,1-20
free-notecards,Free AI Notecards,AI Notecard Generator,"Generate powerful, free notecards from any document for smarter studying.",note-online-study,online
sat-vocabulary,SAT Vocabulary Flashcards,AI SAT Vocab Builder,"Generate SAT vocabulary flashcards from word lists to accelerate exam mastery.",sat-vocab,gre-magoosh
sight,Sight Words Flash Cards,AI Sight Words Generator,"Generate smart sight words flash cards instantly from your learning materials.",high-frequency,dolch-sight
create,AI Flashcard Creator,App to Create Flashcards,"Effortlessly create effective flashcards from your existing study materials and notes.",creator,generator
bicsi-rcdd,Bicsi RCDD Flash Cards,AI RCDD Study Sets,"Generate Bicsi RCDD flash cards from any document for your certification.",api-570,pdf-flashcards
shapes,Shapes Flashcards Generator,AI Shapes Study Cards,"Instantly generate shapes flashcards from any file for mastering geometric concepts.",colors,abc
days-week,Days of the Week Flashcards,AI Weekday Flashcards,"Instantly create smart days of the week flashcards from your documents.",days-months,maker
brown-bear,Brown Bear Flashcards,Study Cards for Brown Bear,"Instantly create flashcards about 'Brown Bear' from your PDF storybook.",zoo-animals,animals
easy-maker,Easy Flashcard Maker,Fast Document to Flashcards,"The easiest flashcard maker: convert any document into a study set fast.",maker,generator
flip-maker,Free Flip Card Maker,AI Flip Card Generator,"Generate instant study decks with our free AI-powered flip card maker.",digital-maker,online-maker
spanish,AI Spanish Flash Cards,Spanish Vocabulary Generator,"Create powerful Spanish vocabulary flash cards automatically from your documents.",french,language-maker
science,Science Flashcards from PDF,AI Science Study Sets,"Convert your science PDFs into smart flashcards instantly for active recall.",biology,organic-chemistry
lange-pathology,Lange Pathology Flash Cards,AI Lange Pathology Decks,"Instantly create Lange Pathology flash cards from any source material.",medstudy,uworld
action,Action Flashcards Creator,AI Action Verbs Cards,"Generate engaging action flash cards from any document to improve vocabulary.",action-verb,verbs
4-seasons,4 Seasons Flashcards,AI Seasons Flashcard Maker,"Generate your custom 4 seasons flashcards instantly from any learning file.",weather,months-year
ap-biology,AP Biology Flashcards,AI AP Bio Study Cards,"Generate perfect AP Biology flashcards instantly for efficient, targeted exam review.",ap-chemistry,sat-vocabulary
adjective,AI Adjective Flashcards,Adjective Flashcard Generator,"Create instant adjective flashcards from your PDF documents for grammar mastery.",antonyms,pronouns
clothes,Clothes Flashcards from PDFs,Apparel Vocabulary Cards,"Generate smart clothes flashcards from any PDF for mastering apparel terminology.",clothes-vocabulary,household-items
create-study-online,Create Study Flashcards Online,Online Study Set Creator,"Create study flashcards online instantly from your materials using smart AI.",online-maker,digital-maker
cantonese,AI Cantonese Flashcards,Cantonese Vocabulary Cards,"Create powerful Cantonese flashcards from any document to master new vocabulary.",marathi,telugu
bedroom,Bedroom Flashcards,AI Household Item Cards,"Instantly create flashcards of bedroom items from any PDF or document.",household-items,house
create-anki-quickly,Create Anki Cards Quickly,Fast Anki Deck Generation,"Instantly create Anki cards from any document to streamline your study workflow.",make-anki-fast,anki-deck-generator
counting,Counting Flashcards from PDF,AI Number Flashcards,"Create counting flashcards directly from any PDF or document for math practice.",1-10,multiplication
community-helpers,Community Helpers Flashcards,AI Community Helper Cards,"Generate instant community helpers flashcards from any educational document.",family-members,professions
activities,Activities Flashcards,AI Study Activity Cards,"Instantly create activities flashcards from any PDF to master your study topics.",exercise,hobbies
consonant-blends,Consonant Blends Flashcards,AI Phonics Cards,"Create smart consonant blends flashcards instantly for foundational reading skills.",vowel,phonics-sound
class-10,"Class 10 Flashcards","AI Study Sets for Class 10","Generate instant Class 10 flashcards from any document for exam success.",class-10-download,ncert
barrons-ap-statistics,Barron's AP Statistics Flashcards,AI AP Stats Cards,"Generate AI Barron's AP Statistics flashcards instantly for top exam scores.",ap-psychology,ap-biology
countries,AI Countries Flashcards,Geography Flashcard Generator,"Instantly create countries flashcards from any PDF for mastering geography facts.",flags-world,capitals
ap-psychology,AP Psychology Flashcards,AI AP Psych Study Aids,"Generate perfect AP Psychology flashcards instantly for effective concept review.",ap-biology,barrons-ap-statistics
cvc-blending,CVC Blending Flash Cards,AI CVC Word Generator,"Create CVC blending flash cards instantly from any source for phonics practice.",cvc,jolly-phonics-group-1
days-week-kindergarten,Kindergarten Days of the Week,Preschool Weekday Flashcards,"Create smart days of the week flashcards for kindergarten-level learning.",days-week,months
esl-adults,ESL Flashcards for Adults,AI English Learning Cards,"Create instant ESL flashcards for adults from your documents for learning English.",esl,english-learning
english-vocabulary,English Vocabulary Cards,AI Vocabulary Builder,"Create smart English vocabulary cards instantly to master words faster.",vocabulary,idioms
directions,Directions Flashcards,AI Navigation Cards,"Instantly create directions flashcards from any file for spatial learning.",transport,location
animals,Flash Cards for Animals,AI Animal Study Guides,"Create instant flash cards from your animals study materials with AI.",zoo-animals,wild-animals
download-from-quizlet,Quizlet Download Alternative,Smarter Flashcard Generation,"Generate smarter flashcards instantly, skipping the Quizlet download hassle.",create-quizlet,sites-like-quizlet
irregular-verbs,Irregular Verbs Flash Cards,AI Verb Form Generator,"Generate smart flash cards from an irregular verbs PDF for grammar practice.",verbs,past-simple-irregular-verbs
days-months,Days and Months Flashcards,AI Calendar Flashcards,"Create days and months flashcards from any document for calendar mastery.",days-week,months-year
family-members,Family Members Flashcards,AI Family Vocabulary Cards,"Generate family members flashcards from any document for vocabulary building.",family,my-family
filipino-alphabet,Filipino Alphabet Flash Cards,AI Baybayin Study Cards,"Create instant Filipino alphabet flash cards from any source for language learning.",filipino,tagalog
esl-action-verbs,ESL Action Verbs Flashcards,English Action Verb Cards,"Generate instant ESL action verbs flashcards from your learning materials.",esl,action-verb
english-verbs,English Verbs Flashcards,AI Verb Conjugation Cards,"Generate English verbs flashcards instantly for mastering grammar and conjugation.",verbs,irregular-verbs
family,Family Flash Cards from PDF,AI Family Tree Cards,"Create family flash cards from your PDFs and documents for social studies.",family-members,my-family
flags-world,Flags of the World Flashcards,AI Flag Identification Cards,"Generate flags of the world flashcards from any document for geography.",countries,capitals
learning-english,Learn English Flash Cards,AI English Study Aids,"Create smart flash cards for learning English from any file.",english-vocabulary,esl
feelings,Feelings Flashcards,AI Emotions Vocabulary Cards,"Instantly create feelings flashcards from any document for emotional vocabulary.",emotions,feeling
download,AI Flash Card Downloader,Instant Study Material,"Generate smart flash cards from any PDF instead of searching for downloads.",maker-download,flash-cards-pdf-free
goodnotes-5,GoodNotes 5 to Flashcards,AI GoodNotes Converter,"Convert GoodNotes 5 notes into active recall flashcards instantly.",goodnotes,one-note
gre-magoosh,GRE Magoosh Flashcards,AI GRE Prep Generator,"Instantly generate AI flashcards from GRE Magoosh materials for smarter prep.",sat-vocabulary,gmat
halloween,Halloween Flashcards,AI Holiday Theme Cards,"Generate smart Halloween flashcards from any PDF for themed learning activities.",winter,summer
food,Food Flashcards from PDFs,AI Food Vocabulary Cards,"Instantly create food flashcards from your PDFs for culinary or language study.",food-vocabulary,fruits-vegetables
class-10-download,Class 10 Flashcard Download,AI Class 10 Study Sets,"Generate AI flashcards for Class 10, no download searching required.",class-10,ncert
fruits-vegetables,Fruits and Vegetables Flashcards,AI Produce Study Cards,"Generate smart flashcards from your fruits and vegetables PDF for study.",fruits,vegetables
histology,AI Histology Flashcards,Histology Slides to Cards,"Generate histology flashcards from your PDF notes instantly for medical school.",biology,lange-pathology
idioms,Idioms Flashcards from PDFs,AI Idiom Study Sets,"Instantly generate idioms flashcards from your documents to master expressions.",phrasal-verbs,english-vocabulary
abc,ABC Flashcards from PDF,AI Alphabet Cards,"Transform your documents into smart alphabet flashcards for learning letters.",alphabet,lowercase-letter
flash-cards-pdf-free,Free Flash Cards from PDF,AI PDF to Cards Converter,"Create smart flash cards from your PDF for free for any subject.",pdf-flashcards,free-notecards
maker-download,Flashcard Maker Download Alt,Instant Online Flashcard Maker,"An instant online tool, a smarter alternative to a flashcard maker download.",maker,digital-maker
fruits,Fruit Flashcards from PDF,AI Fruit Study Cards,"Generate smart flashcards from fruit PDFs instantly for botanical learning.",fruits-vegetables,food
multiplication,Multiplication Flashcards PDF,AI Math Facts Generator,"Create instant flashcards from your multiplication PDF notes for quick practice.",division,math
ipa,IPA Flashcards from PDFs,Phonetics Flashcard Generator,"Create IPA flashcards from your study materials for mastering phonetics.",phoneme,phonogram
integer,Integer Flash Cards,AI Integer Math Practice,"Generate integer flash cards instantly from your PDF notes for math concepts.",math,fraction
phrasal-verbs,Phrasal Verbs Flashcards,AI Phrasal Verb Decks,"Generate flashcards for phrasal verbs instantly from PDFs for language fluency.",idioms,english-verbs
jolly-phonics-group-1,Jolly Phonics Group 1 Cards,AI Jolly Phonics Generator,"Create Jolly Phonics Group 1 flashcards from any file for early reading.",zoo-phonics,cvc
magoosh-vocabulary,Magoosh Vocabulary Flashcards,AI Magoosh Vocab Builder,"Generate smart Magoosh vocabulary flashcards instantly from any study guide.",gre-magoosh,kaplan-gre-vocabulary
make-quizlet,Make Quizlet Sets with AI,AI Quizlet Card Maker,"Stop manual entry and make your Quizlet sets with AI instantly.",create-quizlet,quizlet-make
marathi,Marathi Flashcards PDF,AI Marathi Language Cards,"Create custom Marathi flashcards instantly from any PDF for language study.",telugu,hindi-swar
nasm,AI NASM Flashcards,NASM Study Sets from PDF,"Create NASM flashcards from your PDF study guide instantly for certification.",sie,comptia
make-anki-fast,Make Anki Cards Fast,Quick Anki Deck Creator,"Effortlessly make Anki cards fast from any document for efficient studying.",create-anki-quickly,anki-deck-generator
goodnotes,Goodnotes to Flash Cards,AI Goodnotes Note Converter,"Instantly turn Goodnotes material into smart AI-powered study flash cards.",goodnotes-5,one-note
nelson-denny-vocabulary,Nelson Denny Vocabulary Cards,AI Nelson Denny Prep,"Instantly create Nelson Denny vocabulary flashcards for targeted test preparation.",sat-vocabulary,vocab-maker
medstudy-internal-medicine,MedStudy Internal Medicine Cards,AI MedStudy Flashcards,"Generate instant AI flashcards from your MedStudy internal medicine files.",medstudy,uworld
vocabulary-english,English Vocabulary Flashcards,PDF to Vocab Cards,"Create smart English vocabulary flashcards instantly from any document.",english-vocabulary,vocab-maker
nihongo-notion,Nihongo Flashcards,Japanese Study Card Maker,"Transform your Nihongo study materials into smart flashcards for learning Japanese.",cantonese,spanish
magoosh,Magoosh Flashcards PDF Alt,AI Magoosh Study Tool,"Create AI Magoosh flashcards instantly as a powerful PDF alternative.",gre-magoosh,magoosh-vocabulary
medical-student-anki,Anki for Medical Students,AI Medical Anki Decks,"Create instant flashcards for medical student Anki prep, skipping manual entry.",anki-medical,lange-pathology
note-online-study,Online Note Cards,AI Study Note Generator,"Generate AI note cards online study aids instantly for faster learning.",study-notes,revision-note
medstudy,MedStudy Flashcards,AI MedStudy PDF Converter,"Create powerful MedStudy flashcards from any PDF or document instantly.",medstudy-internal-medicine,medstudy-pediatrics
food-vocabulary,Food Vocabulary Flashcards,Culinary Vocab Cards,"Generate food vocabulary flashcards from any document for culinary studies.",food,healthy-food
make-online,Make Flashcards Online,AI Online Card Creator,"Instantly make your flashcards online from any source using AI power.",online-maker,create-online
modern-real-estate-practice-20th-edition,Modern Real Estate Flashcards,AI Real Estate Prep,"Master Modern Real Estate Practice with AI-generated flashcards from your book.",sie,ged
make,Make Your Own Flashcards,AI Flashcard App,"Instantly make your own flashcards app content from documents using AI.",maker,creator
past-simple-irregular-verbs,Past Simple Irregular Verbs,AI Irregular Verb Cards,"Create past simple irregular verbs flashcards instantly for grammar practice.",irregular-verbs,verbs-english
possessive-pronouns,Possessive Pronouns Flashcards,AI Pronoun Grammar Cards,"Generate possessive pronouns flashcards instantly for mastering English grammar.",personal-pronouns,pronouns
quizlet-make-private,AI Flashcards for Study,Private Study Set Creator,"Ditch manual entry: create private AI flashcards from any file.",create-quizlet,pdf-flashcards
personal-pronouns,Personal Pronouns Flashcards,AI Pronoun Study Sets,"Create personal pronouns flashcards instantly from any document.",possessive-pronouns,pronouns
power-up-1,Power Up 1 Flashcards,AI Power Up Study Aids,"Create AI Power Up 1 flashcards from any document for your coursework.",everybody-up-starter,textbook-flashcards
food-drinks,Food & Drinks Flashcards,Beverage & Food Vocab,"Instantly create food and drinks flashcards from your PDF for learning.",food,fruits-vegetables
months,Months Flashcards from PDF,AI Months of the Year Cards,"Generate months flashcards instantly from your PDF documents for calendar review.",months-year,days-months
quizlet-make,Quizlet Make Alternative,Smarter Quizlet Set Builder,"Bypass manual entry: make your own Quizlet flashcards the smarter way.",make-quizlet,create-quizlet
recycling,Recycling Flashcards,AI Environmental Study Cards,"Generate instant recycling flashcards from any PDF for environmental science topics.",planet,sustainability
picture,Picture Cards from PDF,AI Picture Flashcard Generator,"Create picture cards and flashcards from your PDF documents automatically.",maker-pictures,creator-images
preposition-picture,Preposition Picture Cards,Visual Preposition Flashcards,"Transform documents into smart preposition picture cards for visual grammar learning.",preposition,grammar-adults
fundations-digraph-sound,Fundations Digraph Sound Cards,AI Fundations Cards,"Create Fundations digraph sound cards instantly with AI for phonics learning.",jolly-phonics-group-1,phonics-sound
phoneme,Phoneme Flashcards,AI Phonetic Cards,"Create instant phoneme flashcards from your study material for linguistic practice.",ipa,phonogram
physical-appearance,Physical Appearance Flashcards,Descriptive Adjective Cards,"Generate physical appearance flashcards instantly for descriptive vocabulary building.",adjective,clothes
python,Python Flashcards from PDF,AI Python Study Sets,"Generate instant Python flashcards from your PDF notes to master code concepts.",organic-chemistry,math
planet,Planet Flashcards,AI Solar System Cards,"Generate AI planet flashcards from your study PDF for astronomy lessons.",countries,science
quizlet-game-create,Study Game Generator,Quizlet Game Alternative,"Skip the Quizlet game creation grind; AI generates flashcards for study.",quizlet-make-quiz,test-maker
right-brain-education,Right Brain Education Cards,AI Shichida Flashcards,"Instantly create right brain education flashcards from any document.",shichida,infant-stimulation
tagalog,Tagalog Flashcards,AI Filipino Language Cards,"Create Tagalog flashcards from any document instantly to master the language.",filipino,filipino-alphabet
smartserve-quizlet,SmartServe Quizlet Alternative,AI SmartServe Flashcards,"Ditch manual creation: use AI flashcards for faster SmartServe mastery.",servsafe-7th-edition-quizlet,certification-prep
transport,Transport Flashcards from PDF,AI Transportation Cards,"Create custom transport flashcards from your PDF uploads for vocabulary.",vehicle,directions
tricky,Tricky Words Flashcards,AI Sight Words Helper,"Generate AI flashcards for your tricky words PDF to accelerate learning.",sight,high-frequency
urdu-alphabets,Urdu Alphabets Flashcards,AI Urdu Letter Cards,"Create AI Urdu alphabets flashcards from any document without manual creation.",hindi-swar,marathi
vehicle,Vehicle Flashcards from PDF,AI Transportation Vocabulary,"Create instant vehicle flashcards from any PDF or document for study.",transport,cars
verb,Verb Cards from PDF,AI Verb Flashcard Generator,"Instantly create verb cards from any document for mastering grammar concepts.",verbs,action-verb
weather,Weather Flashcards,AI Climate Study Cards,"Instantly generate weather flashcards from any PDF for meteorology or ESL.",4-seasons,esl-weather
winter-sports,Winter Sports Flashcards,AI Sports Vocabulary,"Create instant AI winter sports flashcards from your documents.",summer-sports,exercise
time,Time Flashcards from PDF,AI Clock Reading Cards,"Create instant AI time flashcards from any PDF for learning to tell time.",telling-time,clock-flashcards
quizlet-create-set,Quizlet Create a Set AI,Automated Study Set Maker,"Ditch 'Quizlet Create A Set'—generate smart flashcards from files now.",quizlet-make-set,create-study-set-quizlet
sat-vocabulary-online,Online SAT Vocabulary Flashcards,Digital SAT Vocab Prep,"Generate SAT vocabulary flashcards online instantly for smarter digital prep.",sat-vocabulary,sat-online
good-notes,Flash Cards from Good Notes,AI Good Notes Converter,"Instantly create flash cards from your Good Notes for smart review.",goodnotes,goodnotes-5
telugu,AI Telugu Flashcards,Telugu Language Card Maker,"Generate Telugu flash cards from your PDF and documents instantly.",marathi,hindi-swar
good-note,Flashcard Good Note,AI Note to Card Converter,"Generate your flashcard good note instantly with AI from any document.",good-notes,convert-notes
quizlet-make-set,AI to Make Quizlet Set,Automated Quizlet Maker,"Ditch manual entry: use AI to make a Quizlet set instantly.",quizlet-create-set,make-quizlet
uworld,AI UWorld Flashcards,UWorld PDF to Cards,"Create UWorld flashcards from your PDF notes instantly with AI.",medstudy,anki-medical
vocab-maker,AI Vocab Flashcard Maker,Instant Vocabulary Sets,"The fastest AI vocab flashcard maker online for maximizing retention.",vocabulary,english-vocabulary
quizlet-create,Quizlet Create Alternative,AI Flashcard Creator,"Effortlessly create your own flashcards with AI, faster than Quizlet.",create-quizlet,quizlet
make-vocabulary,Make Vocabulary Flashcards,AI Vocab List to Cards,"Effortlessly make vocabulary flashcards from any source or word list.",vocab-maker,vocabulary
online-maker,AI Online Flashcard Maker,Web-Based Flashcard Creator,"Generate study decks with an AI online flashcard maker from any document.",digital-maker,website
ardms-abdomen-quizlet,ARDMS Abdomen Flashcards,AI Registry Prep,"Create ARDMS Abdomen flashcards faster than Quizlet for registry success.",uworld,medstudy
online-creator,AI Online Flashcard Creator,Instant Online Study Aids,"The fastest AI online flashcard creator for turning notes into decks.",online-maker,creator
maker,AI Flashcard Maker,Docs to Study Cards,"The ultimate AI flashcard maker for converting complex material into cards.",generator,creator
creator,AI Flashcard Creator,Instant Study Decks,"The fastest AI flashcard creator for serious students using any document.",maker,generator
best-maker,Best Flashcard Maker App,Top AI Study Set Creator,"The best flashcard maker app powered by AI for instant study sets.",maker,easy-maker
generator,AI Flashcard Generator,Fast Study Set Creation,"The ultimate AI flashcard generator for mastering complex materials quickly.",maker,creator
months-year,Months of the Year Flashcards,AI Calendar Cards,"Generate smart months of the year flashcards from any PDF document.",months,days-months
study-notes,Flashcards for Study Notes,Note to Flashcard Converter,"Generate smart flashcards from your study notes instantly for active recall.",convert-notes,revision-note
fema-ics-200-quizlet,FEMA ICS 200 Flashcards,AI FEMA Test Prep,"Generate AI flashcards for FEMA ICS 200, better than generic Quizlet sets.",servicenow-cis-itsm-quizlet,comptia
beginning-sound-picture,Beginning Sound Picture Cards,AI Phonics Picture Cards,"Transform documents into smart flashcards for learning beginning letter sounds.",phonics-sound,letter-sound
api-570,API 570 Flashcards,AI API 570 Prep,"Create your API 570 flashcards instantly using AI for certification.",bicsi-rcdd,nccer-pipefitter
zoo-animals,Zoo Animals Flashcards,AI Animal Study Decks,"Create instant zoo animals flashcards from any document for biology.",animals,wild-animals
servsafe-7th-edition-quizlet,ServSafe 7th Edition Flashcards,AI ServSafe Prep,"Generate AI flashcards for ServSafe 7th Edition, ditching Quizlet.",smartserve-quizlet,epa-608
servicenow-cis-itsm-quizlet,ServiceNow CIS ITSM Cards,AI ServiceNow Prep,"Ditch Quizlet: create ServiceNow CIS ITSM flashcards instantly with AI.",fema-ics-200-quizlet,comptia
tamil,Tamil Flash Cards from PDF,AI Tamil Language Decks,"Generate AI Tamil flash cards from your study materials for learning.",telugu,marathi
tefl,TEFL Flashcards,AI TEFL Concept Cards,"Create smart TEFL flashcards instantly from your course documents.",tesol,esl
quizlet,AI Quizlet PDF Flashcards,PDF to Quizlet Cards,"Stop manually making Quizlet flashcards from PDFs; let AI do it instantly.",create-quizlet,sites-like-quizlet
sites-like-quizlet,Sites Like Quizlet,Quizlet Alternative AI,"Generate smarter flashcards instantly—a better tool than sites like Quizlet.",quizlet,knowt
canva-maker,AI Canva Flashcards Maker,Canva to Study Aids,"The ultimate AI Canva flashcards maker for creating study aids instantly.",maker-pictures,creator-images
evernote,Evernote Flashcards Converter,AI Evernote to Cards,"Transform your Evernote notes into smart flashcards for efficient studying.",one-note,goodnotes
vocabulary,Vocabulary Flash Cards,AI Vocab from PDF,"Generate vocabulary flash cards from your PDF files for any subject.",vocab-maker,english-vocabulary
test-maker,AI Flashcard Test Maker,Quiz Generator from Notes,"The AI flashcard test maker that helps you prepare for any exam.",quiz-maker,create-quiz-quizlet
create-study-set-quizlet,AI Study Set Generator,Beat Manual Quizlet Creation,"Effortlessly create study sets faster and smarter than manual Quizlet entry.",quizlet-create-set,create-quizlet
household-items,Household Items Flashcards,AI Home Vocabulary,"Create instant household items flashcards from your documents for vocab.",bedroom,kitchen-items
quizlet-how-make,How to Make Quizlet Faster,AI Quizlet Set Builder,"AI powers how to make Quizlet flashcards faster from any document.",quizlet-make,make-quizlet
students,Flashcards App for Students,AI Student Study Tool,"Create instant AI flashcards with an app designed for students.",maker,digital-maker
magoosh-gre-vocabulary,Magoosh GRE Vocabulary Cards,AI GRE Vocab Flashcards,"Create smart AI flashcards from Magoosh GRE Vocabulary lists instantly.",gre-magoosh,kaplan-gre-vocabulary
by-chegg,Flashcard Generator by Chegg,AI Study Alternative,"Instantly create effective flashcards, a smart alternative to manual methods.",quizlet,knowt
note-recognition,Note Recognition Flashcards,AI Music Note Reader,"Generate AI note recognition flashcards instantly for mastering music theory.",music-theory,instrument-flashcards
