slug,anchor_text_var_1,anchor_text_var_2,description,related_slug_to_link_1,related_slug_to_link_2
my-family,My Family Flashcards,AI Family Tree Generator,"Create 'My Family Flashcards' directly from any document for projects.",family,family-members
newborn,Newborn Flashcards,AI Infant Care Study,"Create instant newborn flashcards from any document for pediatric knowledge.",infant-stimulation,pediatrics
make-quizlet-live,Quizlet Live Alternative,AI Study Game Maker,"Instantly generate study sets for Quizlet Live style games.",create-quizlet,quizlet-game-create
kaplan-anatomy,Kaplan Anatomy Flashcards,AI Anatomy Prep,"Generate Kaplan anatomy flashcards from any PDF to master anatomy faster.",histology,biology
colors-shapes,Colors and Shapes Flashcards,AI Visual Learning,"Instantly create colors and shapes flash cards from any PDF.",colors,shapes
pathophysiology-exam-1-questions-quizlet,Pathophysiology Exam 1 Prep,AI Patho Questions,"Generate Pathophysiology Exam 1 questions and answers fast from notes.",lange-pathology,medstudy
opposite-adjectives,Opposite Adjectives Flashcards,AI Adjective Antonyms,"Create opposite adjectives flashcards instantly to master descriptive words.",adjectives-opposites,antonyms
feelings-emotions,Feelings & Emotions Cards,PDF to Emotion Flashcards,"Transform your Feelings & Emotions PDFs into smart flashcards.",feelings,emotions
phlebotomy-essentials-7th-edition-quizlet,Phlebotomy Essentials Cards,AI Phlebotomy Prep,"AI flashcards for Phlebotomy Essentials 7th Edition, smarter than Quizlet.",medical-terms,anatomy
summer,Summer Flashcards PDF,AI Seasonal Vocabulary,"Generate custom summer flashcards from any document for themed learning.",winter,4-seasons
shichida-download,Shichida Flashcards Generator,AI Early Learning Tool,"Create your Shichida flashcards instantly with AI, free to start.",shichida,right-brain-education
summer-vocabulary,Summer Vocabulary Flashcards,AI Summer Word Lists,"Create summer vocabulary flashcards from any document for seasonal words.",summer,vocabulary
sat-vocabulary-barrons-test-prep,Barron's SAT Vocabulary,AI SAT Prep from Barron's,"Generate SAT vocabulary flashcards from Barron's prep materials.",barrons-sat-vocabulary,sat-vocabulary
pronoun,AI Pronoun Flashcards,Grammar Card Generator,"Create AI pronoun flashcards from your PDF instantly for grammar fluency.",pronouns,personal-pronouns
tenses,AI Tenses Flashcards,Verb Tense PDF Converter,"Generate tenses flashcards instantly from your notes for grammar.",verbs,past-simple-irregular-verbs
thirsty-crow,Thirsty Crow Flash Cards,AI Story Flashcards,"Generate Thirsty Crow flash cards and story aids instantly with AI.",moral-stories,reading-comprehension
transportation,Transportation Flashcards,AI Vehicle Cards,"Instantly create transportation flashcards from any document for vocab.",transport,vehicle
senses,Senses Flashcards,AI Sensory System Cards,"Generate senses flashcards instantly from any document for biology.",5-senses,five-senses
make-sight,Make Your Own Sight Words,AI Sight Word Creator,"Stop making cards; use AI to make your own sight words flashcards.",sight,dolch-sight
virtual-maker,AI Virtual Flashcards Maker,Online Study Card Creator,"The AI virtual flashcards maker for effortless online studying.",digital-maker,online-maker
winter,Winter Flashcards,AI Winter Theme Cards,"Create powerful winter flashcards from any PDF for seasonal learning.",summer,4-seasons
punctuation,Punctuation Flashcards,AI Grammar Punctuation,"Create punctuation flashcards from PDF documents instantly for writing skills.",grammar-adults,writing-rules
1-20,1-20 Flashcards,AI Number Cards 1-20,"Instantly create 1-20 flashcards from any document for number recognition.",1-10,counting
5-senses,5 Senses Flashcards,AI Senses Study Cards,"Instantly create your 5 senses flashcards from any document.",senses,five-senses