slug,anchor_text_var_1,anchor_text_var_2,description,related_slug_to_link_1,related_slug_to_link_2
create-digital,Create Digital Flashcards,AI Digital Card Maker,"Effortlessly create digital flashcards from your study materials with AI.",digital-maker,online-maker
digraph,Digraph Flashcards from PDF,AI Phonics Digraph Cards,"Instantly create digraph flashcards from your documents for reading practice.",fundations-digraph-sound,phonics-sound
anki-deck-generator,AI Anki Deck Generator,Anki Decks from Files,"The ultimate AI Anki deck generator for complex material; just upload.",anki-maker,create-anki-quickly
anki-maker,AI Anki Flashcards Maker,Smart Anki Card Creator,"The smart AI Anki flashcards maker for fast, free study set creation.",anki-deck-generator,make-anki
one-note,One Note to Flash Cards,AI One Note Converter,"Transform your One Note pages into flash cards instantly with AI.",evernote,goodnotes
create-anki,Create Anki Cards with AI,Automated Anki Maker,"Stop manually making flashcards; use AI to create Anki cards instantly.",make-anki,anki-maker
barrons-sat,Barron's SAT Flashcards,AI SAT Prep Cards,"Create instant AI Barron's SAT flashcards from your study materials.",sat-vocabulary,barrons-sat-vocabulary
make-anki,Make Anki Cards Instantly,AI Anki Card Generator,"Effortlessly make Anki cards from any study material with our AI tool.",create-anki,anki-maker
quizlet-create-study-set,Quizlet Create Study Set Alt,AI Study Set Creator,"Instantly convert documents into smart study sets, automating active recall.",quizlet-create-set,create-study-set-quizlet
make-online-study,Make Online Study Flashcards,AI Online Study Tool,"Instantly make online flashcards to study smarter with AI generation.",online-maker,create-study-online
colregs,COLREGs Flashcards,AI Maritime Rule Cards,"Create smart COLREGs flashcards instantly from your PDF for exam prep.",boat-safety,navigation-rules
anki-note,AI Anki Note Cards,Automated Anki Note Maker,"Stop making Anki note cards manually and let AI create them for you.",create-anki,anki-notes
organic-chemistry,Organic Chemistry Flashcards,AI Orgo Study Sets,"Create organic chemistry flashcards from any PDF instantly for your course.",chemistry,biology
flowers,Flowers Flashcards,AI Botany Study Cards,"Generate flowers flashcards from your PDFs and docs with AI.",plants,fruits
sat-quizlet,SAT Words Quizlet Alt,AI SAT Flashcards,"Generate smarter SAT words flashcards instantly, a better alternative to Quizlet.",sat-vocabulary,barrons-sat
anki-notes,Flashcards from Anki Notes,AI Anki Note Converter,"Instantly create dynamic AI flashcards from your static Anki notes.",anki-note,create-anki
sie,SIE Flashcards,AI SIE Exam Prep,"Convert your SIE study materials into AI flashcards for exam mastery.",nasm,comptia
spelling,Spelling Flashcards,AI Spelling List Generator,"Create custom spelling flashcards from any document to master vocabulary.",vocabulary,english-vocabulary
servsafe-diagnostic-test-quizlet,ServSafe Diagnostic Test Prep,AI ServSafe Flashcards,"Ace your ServSafe Diagnostic Test with AI flashcards, not just Quizlet.",servsafe-7th-edition-quizlet,food-safety
note-name,Note Name Flashcards,AI Music Note Namer,"Transform your music sheets into smart AI flashcards for note naming.",note-recognition,music-theory
language-maker,AI Language Flashcard Maker,Vocabulary Learning Tool,"The ultimate AI language flashcard maker for mastering new vocabulary.",spanish,french
wild-animals,Wild Animals Flashcards,AI Wildlife Study Cards,"Create instant wild animals flashcards from any document for zoology.",animals,zoo-animals
division,AI Division Flashcards,Math Division Practice,"Create smart division flashcards from any PDF for mastering math facts.",multiplication,fraction
create-virtual,Create Virtual Flashcards,AI Virtual Study Decks,"Effortlessly create virtual flashcards from your study files for smarter learning.",digital-maker,online-maker
fundations-trick,Fundations Trick Words,AI Fundations Flashcards,"Create Fundations Trick Words flashcards instantly with AI for reading practice.",fundations-digraph-sound,sight
knowt,Knowt Flashcards Generator,AI Knowt Alternative,"Instantly generate Knowt-style flashcards using AI for faster concept mastery.",quizlet,sites-like-quizlet
handwritten-revision,Handwritten Notes to Flashcards,AI OCR for Notes,"Instantly create flash cards from handwritten revision notes with OCR.",convert-notes,study-notes
create-my-quizlet,Create Your Own Quizlet AI,Personal Quizlet Generator,"Instantly create your own Quizlet cards from any document using AI.",make-my-quizlet,quizlet-create
gmat,GMAT Flashcards,AI GMAT Prep,"Create AI-powered GMAT flashcards from any document for business school prep.",gre-magoosh,sat-vocabulary
best-make,Best App to Make Flashcards,AI-Powered Study App,"The best app to make your own flashcards instantly with AI.",best-maker,best-creating
best-making,Best App for Making Flashcards,Top AI Card Creator,"The best app for making flashcards from your notes using AI.",best-make,best-creator
make-study,Make Your Own Study Flashcards,AI Study Set Maker,"Make your own study flashcards with AI instead of manual creation.",create-study-online,maker-studying
math,AI Math Flash Cards,Math Problem Generator,"Create instant math flash cards from your study materials for any topic.",multiplication,division
revision-note,AI Revision Note Cards,Notes to Study Sets,"Transform any revision note into smart flashcards instantly for exam prep.",study-notes,convert-notes
sat-online,Create SAT Flashcards Online,Digital SAT Prep,"Generate custom SAT flashcards online from any document for test success.",sat-vocabulary-online,barrons-sat
quizlet-make-quiz,AI Quiz Maker,Smarter Quizlet Alternative,"Stop manually making quizzes; use our AI flashcard generator instead.",test-maker,quiz-maker
asl,AI ASL Flash Cards,ASL Sign Language Cards,"Create AI ASL flash cards instantly from your documents for learning.",language-maker,spanish
study-maker,AI Study Flashcard Maker,PDF to Study Cards,"The smartest AI study flashcard maker available for any subject.",maker,maker-studying
esl,ESL Flashcards from PDF,AI English as a Second Language,"Create powerful ESL flashcards from PDFs instantly for language learners.",esl-adults,english-learning
best-website-make,Best Website to Make Flashcards,Top Online Flashcard Maker,"The best website to make flashcards using your own study material.",website,online-maker
interactive-maker,AI Interactive Flashcard Maker,Engaging Study Sets,"The fastest AI interactive flashcard maker for dynamic, active recall.",maker,digital-maker
best-create,Best App to Create Flashcards,Top AI Study App,"The best app to create flashcards from any document with AI.",best-maker,creator
website,AI Notecards Website,Online Study Set Generator,"The AI notecards website that creates your study sets in seconds.",online-maker,best-website-make
epa-608,EPA 608 Flashcards,AI EPA Test Prep,"Instant EPA 608 flashcards generated from your study materials for certification.",servsafe-7th-edition-quizlet,api-570
online-study-note,Online Study Note Cards,AI Revision Card Creator,"Create powerful online study note cards from any document for review.",note-online-study,study-note
multiplication-table,Multiplication Table Cards,AI Times Table Generator,"Generate multiplication table flash cards from any document for math mastery.",times-table,multiplication
french,AI French Flash Cards,French Vocabulary Generator,"Create custom French flash cards from any document for language learning.",spanish,language-maker
cvc,CVC Flash Cards from PDF,AI CVC Word Family Cards,"Convert any CVC PDF to smart flash cards for mastering phonics.",cvc-blending,phonics-sound
five-senses,Five Senses Flashcards,AI 5 Senses Cards,"Create five senses flashcards instantly from your materials for sensory learning.",5-senses,senses
maker-program,Flashcard Maker Program,AI Study Software,"The ultimate AI flashcard maker program for students and professionals.",maker-software,maker
healthy-food,Healthy Food Flashcards,AI Nutrition Study Cards,"Create healthy food flashcards from any document instantly for nutrition.",food,food-vocabulary
study-note,AI Study Note Cards,Note to Flashcard Tool,"Transform your study notes into powerful AI flashcards for any subject.",study-notes,convert-notes
stationery,Flash Cards Stationery Alt,Digital Study Cards,"Create intelligent flash cards from any document, replacing physical stationery.",digital-maker,online-maker
times-table,Times Table Flash Cards,AI Multiplication Cards,"Generate times table flash cards from any document for math practice.",multiplication-table,multiplication
shichida,AI Shichida Flashcards,Shichida Method Cards,"Generate AI Shichida flashcards from any document for early learning.",right-brain-education,infant-stimulation
best-creating,Best App for Creating Flashcards,AI Note to Card App,"The best app for creating flashcards from your study materials.",best-create,best-maker
telling-time,Telling Time Flash Cards,AI Clock Flashcards,"Instant AI telling time flash cards from any document for kids.",time,clock-flashcards
flash-cards-pdf,Flash Cards PDF Generator,AI PDF to Flashcards,"Turn any PDF into intelligent flash cards instantly for faster learning.",pdf-flashcards,flash-cards-pdf-free
ncert,NCERT Flashcards,AI NCERT Study Aids,"Instantly generate personalized NCERT flashcards for Indian curriculum studies.",class-10,cbse-flashcards
birds,AI Birds Flashcards,Ornithology Study Cards,"Create instant AI birds flashcards from any document for ornithology.",animals,wild-animals
anki-medical,AI Medical Flashcards,Anki Alternative for Medicine,"Ditch manual decks: AI flashcards for Anki medical prep are faster.",medical-student-anki,uworld
blend,Blend Flashcards from PDF,AI Phonics Blend Cards,"Create smart flashcards from any blend PDF or document for reading.",consonant-blends,digraph
pre-primer-sight,Pre-Primer Sight Words Cards,AI Sight Word Flashcards,"Instantly generate Pre-Primer sight words flash cards beyond static PDFs.",sight,dolch-sight
online-vocabulary,Online Vocabulary Flashcards,AI Digital Vocab Cards,"Create perfect online vocabulary flashcards with AI, beating manual creation.",vocabulary,vocab-maker
create-quiz-quizlet,AI Quiz Creator,Smarter than Quizlet,"Instantly create quizzes and flashcards from any document with AI.",quiz-maker,test-maker
create-online,Create Flashcards Online Free,AI Online Card Generator,"Instantly create flashcards online free from any document with AI.",online-maker,make-online
plants,AI Plants Flashcards,Botany Study Cards from PDF,"Generate plants flashcards instantly with AI for mastering botany concepts.",flowers,biology
insect,AI Insect Flashcards,Entomology Study Cards,"Create custom insect flashcards from any PDF for entomology studies.",animals,biology
lowercase-letter,Lowercase Letter Flashcards,AI Alphabet Learning,"Create AI flashcards for lowercase letters from any document or PDF.",alphabet,abc
quizlet-test-maker,AI Quizlet Test Maker Alt,Smarter Test Generator,"A smarter AI alternative to the Quizlet test maker for active recall.",test-maker,quiz-maker
prefixes-suffixes,Prefixes and Suffixes Cards,AI Affix Flashcards,"Create AI prefixes and suffixes flashcards instantly for vocabulary building.",english-vocabulary,grammar-adults
alphabet,AI Alphabet Flash Cards,Free Letter Card Generator,"Generate free alphabet flash cards from any document for learning letters.",abc,lowercase-letter
pronouns,AI Pronouns Flashcards,Grammar Pronoun Cards,"Create instant pronouns flashcards from your study materials for grammar.",personal-pronouns,possessive-pronouns
blank,AI Flash Cards from PDFs,Automated Card Creator,"Stop making blank flash cards from PDFs; let AI create content for you.",pdf-flashcards,maker
long-vowel,Long Vowel Flashcards,AI Long Vowel Sound Cards,"Create long vowel flashcards from any document instantly for phonics.",vowel,short-vowel
high-frequency,High Frequency Words Cards,AI Sight Word Lists,"Create high frequency words flashcards from any document for reading fluency.",sight,dolch-sight
write,Write Flashcards with AI,Automated Flashcard Writing,"Instantly write flashcards from any document using AI for speed and precision.",maker,creator
zoo-phonics,Zoo Phonics Flash Cards,AI Phonics Learning,"Create Zoo Phonics flash cards from your learning materials with AI.",jolly-phonics-group-1,phonics-sound
automatic-maker,Automatic Flashcard Maker,Instant AI Study Aids,"The ultimate automatic flashcard maker for turning documents into study sets.",maker,generator
kaplan-gre-vocabulary,Kaplan GRE Vocabulary Cards,AI GRE Vocab Prep,"Generate Kaplan GRE vocabulary flashcards from your PDF instantly.",gre-magoosh,magoosh-gre-vocabulary
medstudy-pediatrics-download,Pediatrics Flashcards from PDF,AI MedStudy Peds Cards,"Generate smart flashcards from MedStudy Pediatrics PDFs for board review.",medstudy,medstudy-pediatrics
ap-chemistry,AP Chemistry Flashcards,AI AP Chem Prep,"Create smart AP Chemistry flashcards from your study materials instantly.",ap-biology,organic-chemistry
create-vocabulary,Create Vocabulary Flashcards,AI Vocab Card Generator,"Create vocabulary flashcards from any source instantly for language learning.",make-vocabulary,vocab-maker
barrons-sat-vocabulary,Barron's SAT Vocabulary Cards,AI Barron's SAT Prep,"Stop manually making Barron's SAT vocabulary flashcards; use AI instead.",barrons-sat,sat-vocabulary
creator-images,Flashcard Creator with Images,AI Visual Flashcards,"The effortless flashcard creator with images, powered by visual AI.",maker-pictures,picture
comptia,CompTIA A+ Flashcards,AI CompTIA Prep,"Generate CompTIA A+ flashcards from any PDF instantly for IT certification.",nasm,sie
abacus,AI Abacus Flash Cards,Math Abacus Practice,"Create abacus flash cards instantly from any PDF for mental math training.",math,counting
nccer-pipefitter,NCCER Pipefitter Flashcards,AI Trade School Prep,"Master NCCER Pipefitter concepts with AI flashcards for your certification.",api-570,trades-prep
ged,Instant GED Flashcards,AI GED Test Prep,"Create unlimited GED flashcards from any document for test preparation.",sat-vocabulary,gmat
maker-studying,Flashcard Maker for Studying,Best AI Study Tool,"The ultimate flashcard maker for studying, with AI-generated sets.",study-maker,maker
online,Free Notecards Online,AI Web Notecard Maker,"Generate free notecards online instantly with AI from your study docs.",free-notecards,online-maker
make-my,Make Your Own Flashcards AI,Personal Flashcard Creator,"Effortlessly make your own flashcards with our AI app from any document.",make,creator
shape,Shape Flash Cards from PDF,AI Geometry Cards,"Create instant shape flash cards from your PDF files for geometry.",shapes,colors
maker-software,Flash Card Maker Software,AI Study Program,"The easiest AI flash card maker software available for instant studying.",maker-program,digital-maker
emotions,Emotions Flashcards,AI Feelings Study Cards,"Instantly create emotions flashcards from any document for social learning.",feelings,emotions-feelings
dolch-sight,Dolch Sight Word Flash Cards,AI Dolch Word Generator,"Create instant AI Dolch sight word flash cards, beating static PDF lists.",sight,pre-primer-sight
alphabet-letter,Alphabet Letter Cards,AI Letter Learning,"Generate alphabet letter cards from your PDF instantly for early literacy.",alphabet,lowercase-letter
fraction,Fraction Flash Cards,AI Math Fraction Helper,"Generate instant fraction flash cards from any PDF for math concepts.",division,integer
money,AI Money Flashcards,Currency Study System,"Create AI money flashcards from any document for financial literacy.",math,counting
make-my-quizlet,Make Your Own Quizlet AI,Faster Quizlet Creation,"Stop manual entry: make your own Quizlet sets instantly with AI.",create-my-quizlet,quizlet-make
letter-sound,Letter Sound Cards,AI Phonics Generator,"Create AI letter sound cards from any PDF for mastering phonics.",beginning-sound-picture,phonics-sound
esl-weather,ESL Weather Flashcards,English Weather Vocabulary,"Generate AI ESL weather flashcards instantly for mastering English vocabulary.",esl,weather
create-quizlet-quiz,Create Quizlet Quiz with AI,Smarter Quiz Generator,"Instantly create Quizlet quiz material with AI for effective testing.",quizlet-make-quiz,create-quiz-quizlet
sat-vocab,AI SAT Vocab Flashcards,Instant SAT Word Prep,"Generate instant SAT vocab flashcards with AI for essential exam prep.",sat-vocabulary,barrons-sat-vocabulary
families,Word Families Flashcards,AI Phonics Family Cards,"Create instant word families flashcards from your study materials.",phonics-sound,cvc
addition-subtraction,Addition & Subtraction Cards,AI Math Fact Flashcards,"Generate addition and subtraction flash cards instantly for math practice.",addition,subtraction
singular-plural,Singular and Plural Flashcards,AI Grammar Noun Cards,"Instantly create singular and plural flashcards for mastering grammar rules.",pronouns,nouns
cursive,AI Cursive Flashcards,Handwriting Practice Sheets,"Generate cursive flashcards from your study material for handwriting practice.",alphabet,writing-practice
addition,AI Addition Flashcards,Math Addition Practice,"Generate instant addition flashcards from any PDF for mastering math facts.",addition-subtraction,math
quiz-maker,AI Flashcard Quiz Maker,Study Set Quiz Generator,"The fastest AI flashcard quiz maker available for smarter studying.",test-maker,create-quiz-quizlet
phonics-sound,Phonics Sound Cards,AI Phonics Deck Creator,"Create phonics sound cards from any document instantly for reading.",jolly-phonics-group-1,letter-sound
notes,AI Flash Card Notes,Document to Note Cards,"Generate smart flash card notes from any document for study efficiency.",study-notes,convert-notes
ai-generator,AI Flashcards Generator,Instant Study Material,"An instant AI flashcards generator from your study materials for smart learning.",generator,maker
community-signs,Community Signs Flashcards,AI Sign Recognition Cards,"Create instant AI flashcards for community signs from a PDF.",directions,safety-signs
opposite,Opposite Flashcards,AI Antonym Generator,"Create opposite flashcards from any PDF or document to expand vocabulary.",antonyms,synonyms-antonyms
short-vowel,Short Vowel Flashcards,AI Short Vowel Sound Cards,"Instantly create short vowel flashcards from your documents for phonics.",vowel,long-vowel
color,AI Color Flash Cards,PDF to Color Cards,"Generate AI color flash cards directly from your PDF for learning.",colors,shapes
anki-medical-students,AI Flashcards Medical Students,Smarter Anki for Medicine,"Replace manual Anki setup with AI flashcards for medical students.",anki-medical,medical-student-anki
action-picture,Action Picture Study Cards,Visual Action Verbs,"Instantly create study cards from any action picture PDF for visual learning.",action-verb,picture
action-verb,Action Verb Flashcards,AI Verb Study Cards,"Create action verb flashcards from any document instantly for grammar.",verbs,action
create-multiple-choice,Multiple Choice Flashcards,AI Question Generator,"Instantly create multiple choice flashcards and questions with AI.",test-maker,quiz-maker
convert-notes,Convert Notes to Flashcards,AI Note Converter,"Effortlessly convert your notes to flashcards using AI for active recall.",study-notes,handwritten-revision
pdf-flashcards,PDF to Flashcards,AI PDF Converter,"Convert any PDF to flashcards instantly with AI for content mastery.",flash-cards-pdf,maker-from
maker-from,Flashcard Maker from PDF,Create Cards from Docs,"Instantly create flashcards from any PDF or document for deeper retention.",pdf-flashcards,maker
exercise,Exercise Flash Cards,AI Fitness Study Aids,"Create AI flash cards from your exercise PDFs for personal training.",nasm,health-flashcards
program-make,Program to Make Flashcards,AI Flashcard Software,"The smartest program to make flashcards from your notes automatically.",maker-program,maker-software
fruit-vegetable,Fruit and Vegetable Flashcards,AI Produce ID Cards,"Instantly create fruit and vegetable flashcards from your PDF.",fruits-vegetables,food
fruit,AI Fruit Flashcards,Fruit Cards from PDF,"Instantly create fruit flash cards from any PDF for easy learning.",fruits,food
70-phonograms,70 Phonograms Flashcards,AI Phonogram Mastery,"Generate AI flashcards for mastering the 70 phonograms from any guide.",phonogram,phonics-sound
synonyms-antonyms,Synonyms and Antonyms Cards,AI Vocabulary Flashcards,"Create synonyms and antonyms flashcards from any document for vocab.",antonyms,opposite
adjectives-opposites,Adjectives Opposites Flashcards,AI Adjective Pairs,"Instant adjectives opposites flashcards from any document for vocabulary.",adjective,antonyms
grammar-adults,English Grammar for Adults,AI Grammar Flashcards,"Instantly generate grammar flashcards for adults to master English.",esl-adults,english-learning
animals-kindergarten,Animals Flashcards Kindergarten,Preschool Animal Cards,"Create smart animals flashcards for kindergarten instantly from any material.",animals,zoo-animals
phonogram,Phonogram Flash Cards,AI Phonics Cards,"Create smart phonogram flash cards from any document for reading.",70-phonograms,phoneme
cgp-combined-science-revision,CGP Combined Science Cards,AI CGP Revision Aids,"Generate instant AI CGP Combined Science revision cards from your guide.",science,biology
babok-30,BABOK 3.0 Flashcards,AI BABOK Prep,"Create smart BABOK 3.0 flashcards from your PDF for business analysis.",pmp-prep,certification-flashcards
clothes-vocabulary,Clothes Vocabulary Flashcards,Apparel Vocab Cards,"Generate clothes vocabulary flashcards from any file to optimize memorization.",clothes,vocabulary
antonyms,Antonyms Flashcards,AI Opposite Word Generator,"Create powerful antonyms flashcards from your study materials for vocabulary.",synonyms-antonyms,opposite
comparatives,Comparatives Flashcards,AI Grammar Cards,"Instantly create comparatives flashcards from your files for grammar mastery.",adjective,superlatives
critical-pass-reddit,Critical Pass Alternative,PDF to Study Aids,"Generate Critical Pass style flashcards from your PDF notes instantly.",bar-exam,law-school
farm-animals,Farm Animal Flashcards,AI Farm Animal Cards,"Generate farm animals flash cards from any document for learning.",animals,zoo-animals
feeling,Feeling Flashcards Generator,AI Emotion Cards,"Generate feeling flashcards from any PDF instantly to study psychology.",feelings,emotions
create-goodnotes,Flashcards from Goodnotes,AI Goodnotes Converter,"Instantly create flashcards from Goodnotes files for seamless studying.",goodnotes,goodnotes-5
conversation,Conversation Flashcards,AI Dialogue Prompts,"Generate instant conversation flashcards from any document for language practice.",english-learning,spanish
filipino,Filipino Flashcards from PDF,AI Filipino Language Cards,"Generate AI-powered Filipino flashcards from any PDF for faster learning.",tagalog,filipino-alphabet
everybody-up-starter,Everybody Up Starter Cards,AI ESL Kids Flashcards,"Create instant AI flashcards for Everybody Up Starter curriculum.",power-up-1,esl
verbs,Verbs Flash Cards PDF,AI Verb Conjugation,"Generate flash cards for verbs from PDF content automatically.",verb,action-verb
action-verbs,Action Verbs Flashcards PDF,AI Verb Study Sets,"Generate study flashcards from your action verbs PDFs for grammar.",action-verb,verbs
english-online,English Flashcards Online,AI Online English Learning,"Create effective English flashcards online from any source for language mastery.",english-learning,online-vocabulary
verbs-english,Verbs in English Flashcards,AI English Verb Cards,"Generate AI flashcards for verbs in English from your PDFs.",english-verbs,irregular-verbs
biology,AI Biology Flashcards,PDF to Biology Study Guide,"Create smart, free biology flashcards from any document for your class.",science,organic-chemistry
emotions-feelings,Emotions and Feelings Cards,AI Social-Emotional Learning,"Instantly create emotions and feelings flashcards from any file.",emotions,feelings
english-learning,English Learning Cards,AI ESL Flashcards,"Create AI English cards for learning from any PDF for vocabulary.",esl,learning-english
greeting,Greeting Flashcards,AI Conversation Starters,"Generate greeting flashcards instantly from your PDF files for social skills.",greetings-kindergarten,conversation
greetings-kindergarten,Kindergarten Greetings Cards,Preschool Social Skills,"Generate AI greetings flashcards for kindergarten from any PDF.",greeting,social-stories
house,House Flashcards from PDF,AI Home Vocabulary Cards,"Create instant 'house' flashcards from any PDF for vocabulary.",household-items,bedroom
hello,Instant Study Flashcards,AI Document Converter,"Transform documents into smart flashcards with AI for maximum retention.",maker,pdf-flashcards
infant-stimulation,Infant Stimulation Flashcards,AI Baby Learning Cards,"Create infant stimulation flashcards from your study materials for development.",newborn,shichida
greetings-english,English Greetings Flashcards,AI ESL Conversation,"Instantly create greetings flashcards in English from PDF for conversation.",greeting,english-learning
hindi-swar,Hindi Swar Flashcards,AI Hindi Vowel Cards,"Create custom Hindi Swar flashcards from your study material.",marathi,urdu-alphabets
medstudy-pediatrics,MedStudy Pediatrics Flashcards,AI Peds Board Prep,"Convert your MedStudy Pediatrics PDFs to smart flashcards for boards.",medstudy,anki-medical
midterm-notes,Midterm Notes to Flashcards,AI Exam Prep Generator,"Instantly create AI midterm notes and flashcards for exam preparation.",study-notes,revision-note
jolly-phonics-download,Jolly Phonics Flashcards,AI Phonics Card Generator,"Create instant Jolly Phonics flashcards from any document, free to start.",jolly-phonics-group-1,phonics-sound
