slug,question_1,answer_1,question_2,answer_2,question_3,answer_3
vocabulary,What is a vocabulary flash card?,A card with a word on one side and its definition, usage, or translation on the other.,Why is the use of flash cards effective for vocabulary mastery?,They facilitate rapid testing and active recall of definitions.,What is a synonym for 'ambiguous'?,Vague, unclear, or open to multiple interpretations.
test-maker,What is the primary function of an AI Flashcard Test Maker?,To generate questions and answer options directly from study materials, often including multiple-choice.,How does the AI Test Maker 'learn' with the student?,It tracks performance and focuses review on frequently missed or difficult concepts.,What is the benefit of generating a multiple-choice test from flashcards?,It simulates exam conditions, testing recognition as well as recall.
create-study-set-quizlet,Why is AI faster than manually using "Quizlet Create Study Set"?,AI automatically extracts and formats the data from the source document (PDF, notes).,What is a "Study Set"?,A collection of related flashcards, often used interchangeably with "deck.",How does AI help students master material more efficiently?,By shifting their time investment from manual creation to active testing and review.
household-items,Name three common items found in a kitchen.,Refrigerator, stove, microwave, dishes, utensils (any three).,What household item is used to clean floors by sucking up dirt?,Vacuum cleaner.,What is the term for the large container used for washing clothes?,Washing machine.
quizlet-how-make,What core process does AI automate when answering "Quizlet how to make flashcards"?,The manual transcription of notes into individual card prompts and definitions.,Why do students seek methods to make flashcards faster?,To reduce the setup time for large, content-heavy exams.,What is a benefit of having endless study sets instantly?,It allows for targeted practice on every single topic within a document.
students,Why are AI flashcards considered essential for modern students?,They align with active recall and spaced repetition, the most effective study methods.,What is the main goal of using a flashcard app for students?,To maximize learning efficiency and achieve mastery of complex subjects.,How does AI help students manage vast amounts of material?,By breaking down large documents into manageable, bite-sized study units.
magoosh-gre-vocabulary,Define the Magoosh GRE word 'gregarious.',Sociable, fond of company.,What does the GRE word 'voluminous' mean?,Occupying or containing much space; large in volume.,Why is active recall vital for GRE vocabulary success?,It ensures the student can instantly retrieve the definition, which is necessary for the exam's rapid pace.
by-chegg,What is the primary function of a flashcards generator 'by Chegg' or similar platforms?,To provide automated study tools that simplify the conversion of class material into review sets.,How does AI improve the quality of generated flashcards?,It uses natural language processing to create clear, concise question/answer pairings.,What is the main benefit of using a generator over manual note-taking?,It shifts the focus from passively recording information to actively mastering it.
note-recognition,What is AI Note Recognition?,The technology used to read and process text, including handwritten or poorly formatted notes, for digital use.,How does AI Note Recognition help create flashcards?,It converts the raw, unstructured text of notes into structured Q&A pairs.,Why is it difficult for computers to process handwritten notes?,Handwriting varies greatly in style, spacing, and neatness, requiring sophisticated algorithms (OCR).
create-digital,What is a 'digital flashcard'?,An electronic representation of a physical flashcard, stored and studied on a computer or mobile device.,What is the advantage of a digital flashcard over a paper one?,Digital cards offer portability, searchability, and integration with SRS algorithms.,How does AI make the creation of digital flashcards effortless?,By extracting text from existing documents and automatically formatting the cards.
digraph,Give an example of a digraph that represents a consonant sound.,Sh, ch, th, ph, wh (any one).,What is the key rule for a digraph?,The two letters must produce only one sound.,What is the 'wh' digraph's sound (in most dialects)?,The /w/ sound (as in "when").
anki-deck-generator,What is an 'Anki Deck'?,A collection of related flashcards within the Anki application.,How does an AI Anki Deck Generator save time?,It skips the need to manually import, format, and tag thousands of cards for the SRS system.,What is the most complex material AI generators handle best for Anki?,Dense, text-heavy PDFs and textbook chapters.
anki-maker,What is the primary purpose of an AI Anki Flashcards Maker?,To automate the conversion of large study materials into structured Anki notes and cards.,What makes the AI Anki Maker 'smart'?,It optimizes the card content and formatting for Anki's specific review algorithm.,Why is the AI maker considered 'free' for study sets?,It leverages AI to generate the basic material, requiring no payment for the core conversion process.
one-note,What is Microsoft OneNote primarily used for?,Digital note-taking, organization, and information gathering across different devices.,How does AI transform OneNote content into flashcards?,It extracts organized sections, bullet points, or definitions and formats them as testable Q&A.,What is the benefit of integrating flashcards with a note-taking app like OneNote?,It streamlines the workflow from initial note-taking to final revision.
create-anki,What are the two components needed to create an effective Anki card?,A question/prompt on the front and the corresponding answer/explanation on the back.,Why is manual Anki card creation tedious?,It involves repetitive text entry, tagging, and formatting for each individual card.,How does AI solve the problem of manual Anki creation?,By instantly converting document text into ready-to-import Anki Note files.
barrons-sat,What is Barron's known for in test preparation?,Providing comprehensive review books and practice materials for standardized tests like the SAT.,What section of the SAT benefits most from flashcard review?,The Critical Reading and Vocabulary sections.,How does AI assist with Barron's SAT materials?,It extracts key concepts and vocabulary from the review book text for active recall practice.
make-anki,What is the central function of the AI tool in making Anki cards?,To perform rapid extraction and structuring of content from source documents.,Why is Anki's spaced repetition effective?,It schedules reviews based on memory retention, ensuring you study the right cards at the optimal time.,What output format is typically required for importing cards into Anki?,A CSV or TSV (tab-separated value) file.
quizlet-create-study-set,Why should a student choose AI over manually using "Quizlet Create Study Set"?,To eliminate the time spent on manual transcription and focus entirely on studying.,What does the AI generator prioritize when creating study sets?,Extracting specific terms, definitions, and concise facts from the source material.,What is the benefit of automating Active Recall preparation?,It allows students to tackle much larger volumes of material more effectively.
make-online-study,What is the advantage of using AI to make online flashcards for study?,Instant conversion means students can immediately begin testing their knowledge.,How does an AI tool help you make online flashcards effectively?,It ensures the cards are well-formed, concise, and focused on high-yield information.,What is the main goal of making flashcards to study smarter?,To maximize long-term retention through active engagement with the material.
colregs,What does COLREGs stand for?,International Regulations for Preventing Collisions at Sea.,What is the purpose of COLREGs?,To establish rules for all vessels on the high seas and in connecting waters to prevent collisions.,What is a 'vessel restricted in her ability to maneuver' (RAM)?,A vessel that, due to the nature of her work, is unable to keep out of the way of another vessel.
anki-note,What is an 'Anki Note'?,The source information (containing fields like question, answer, source) from which Anki generates one or more cards.,How does AI prevent the manual tedium of creating Anki Notes?,It automatically populates the required fields (Front, Back) from the source document.,What is the key difference between an Anki Note and an Anki Card?,A Note is the underlying data; a Card is the visual manifestation used for review.
organic-chemistry,What is a functional group?,A specific group of atoms within a molecule that determines the molecule's characteristic chemical reactions.,Define 'isomerism.',The phenomenon where two or more compounds have the same formula but different structures.,What is the general term for a carbon-hydrogen chain structure?,Hydrocarbon.
flowers,Name three common types of flowers.,Rose, tulip, sunflower, daisy, lily (any three).,What is the female reproductive part of a flower called?,Pistil or carpel.,What is the primary function of a flower's petals?,To attract pollinators (e.g., insects, birds).
sat-quizlet,Why is an AI alternative better than relying on generic SAT Words Quizlet sets?,AI allows you to generate flashcards tailored specifically to your chosen study guide or textbook.,Define the SAT word 'capricious.',Given to sudden and unaccountable changes of mood or behavior.,What is the benefit of generating SAT flashcards instantly?,It maximizes the time available for practicing the vocabulary under timed conditions.
anki-notes,What is the key benefit of converting existing Anki Notes into AI flashcards?,It allows for rapid reorganization or format changes outside of the native Anki interface.,Why would a student want to create new flashcards from their old Anki Notes?,To synthesize or condense information for a final exam or board review.,How does AI assist in reviewing Anki Notes?,It can extract the core content and present it in new, testable ways.
sie,What does SIE stand for in the finance industry?,Securities Industry Essentials.,What organization administers the SIE exam?,FINRA (Financial Industry Regulatory Authority).,What is the SIE exam designed to assess?,A candidate's knowledge of fundamental securities industry concepts.
spelling,Spell the word for a small, four-legged household pet.,Cat (or dog, pet, etc.).,What is the term for a word that sounds the same but has a different spelling and meaning (e.g., to, too, two)?,Homophone.,How does AI help master spelling vocabulary?,It generates flashcards that test the visual memory of the correct spelling.
servsafe-diagnostic-test-quizlet,What is the typical passing score for the ServSafe Manager Exam?,75% (60 correct out of 80 questions).,Why should students use AI instead of relying on a diagnostic test Quizlet?,AI generates practice questions and flashcards directly aligned with the official ServSafe content domains.,What is the purpose of a diagnostic test?,To assess a student's current knowledge level before beginning formal study.
note-name,What is a 'Note Name' in the context of music theory?,The letter or term used to identify a specific pitch (e.g., C, D, E).,How do AI flashcards help in mastering note names?,They automate the testing of note identification, often using images of sheet music or keys.,What is the purpose of transforming documents into flashcards?,To make information active and testable for memory retention.
language-maker,What is the primary function of an AI Language Flashcard Maker?,To rapidly generate vocabulary, grammar, and conjugation cards from text or dictionaries.,How does AI accelerate language learning?,It focuses on high-frequency words and grammatical structures for efficient memorization.,Name two components of language study where flashcards are highly effective.,Vocabulary acquisition and verb conjugation.
wild-animals,Name three examples of wild animals.,Lion, bear, deer, wolf, tiger (any three).,What is a habitat?,The natural home or environment of an animal, plant, or other organism.,What is the primary characteristic of a carnivore?,An animal that feeds chiefly on other animals (meat).
division,What is the result of 10 divided by 2?,Five (5).,In the equation 12 ÷ 3 = 4, what is the number 12 called?,The dividend.,If you have 15 cookies and divide them equally among 5 friends, how many does each friend get?,3 cookies (15 ÷ 5 = 3).
create-virtual,What is a 'virtual flashcard'?,A digital, interactive study card existing solely in an electronic environment.,Why is it important to create virtual flashcards that 'stick'?,They should be concise, visually clear, and integrated with SRS to maximize long-term retention.,How does AI facilitate the creation of virtual flashcards?,It converts complex text into a clean, digital Q&A format, optimized for online platforms.
fundations-trick,What is the focus of Fundations Trick Words instruction?,Instant recognition of high-frequency words with irregular spellings.,Give two examples of Fundations Trick Words.,Said, was, have, from, one (any two).,What is the primary difference between Trick Words and regular words in Fundations?,Trick Words cannot be sounded out using taught phonetic rules.
knowt,What is Knowt primarily known for in the study market?,Its ability to convert notes and documents into flashcards and quizzes.,How does the AI in Knowt assist students?,It extracts key terms and generates study materials automatically.,What is the core feature that Knowt users leverage?,The rapid conversion of text into testable study assets.
handwritten-revision,What technology enables the conversion of handwritten notes to flashcards?,Optical Character Recognition (OCR).,Why is converting handwritten notes beneficial for revision?,It cleans up the notes, makes them searchable, and formats them for active recall systems.,What type of flashcard is best suited for handwritten revision notes?,Cards that directly test the key facts summarized in the notes.
create-my-quizlet,What is the benefit of using AI to "Create My Own Quizlet Cards"?,It bypasses the time-intensive typing required for manual card creation.,How does AI ensure the custom nature of the generated Quizlet cards?,It uses *your* uploaded notes and documents as the sole source of content.,What is the main goal of using AI in this process?,To shift the student's energy from data entry to actual study and review.
gmat,What is the GMAT exam designed to assess?,Analytical writing, quantitative reasoning, verbal reasoning, and integrated reasoning skills for business school.,What type of flashcards are crucial for GMAT Verbal preparation?,Vocabulary and Critical Reasoning concept cards.,Name one section of the GMAT exam.,Quantitative, Verbal, Integrated Reasoning, or Analytical Writing Assessment (AWA).
best-make,What makes an app the "Best App to Make Your Own Flashcards"?,Its ability to automate the entire process from input (notes) to output (testable cards).,How does AI technology enhance the utility of a flashcard app?,It provides instant extraction, smart formatting, and often integrates SRS.,What is the key criterion for a flashcard app's success?,Its effectiveness in improving long-term memory retention and recall speed.
best-making,Why is AI critical for the 'Best App for Making Flashcards'?,It provides the speed and accuracy necessary to manage the large study loads of serious students.,How does the app minimize friction in the flashcard creation process?,By allowing direct upload of notes and automatic content generation.,What is the primary benefit of making flashcards from your *own* notes?,The content is tailored and more contextually relevant to your learning.
make-study,Why is manual creation an outdated way to "Make Your Own Study Flashcards"?,It is highly time-consuming, diverting attention from the actual process of active learning.,How does AI embody the "Future of Efficient Studying"?,By automating the tedious data prep, it allows students to focus solely on memory mastery.,What is the first step when using an AI tool to create study flashcards?,Uploading or pasting the source material you need to learn.
math,What is the formula for the area of a rectangle?,Area = Length × Width.,What is the square root of 25?,Five (5).,Define a prime number.,A whole number greater than 1 whose only two positive divisors are 1 and itself.
revision-note,What is the purpose of a revision note card?,To provide a high-yield, condensed summary for final review before an exam.,How does AI convert revision notes into flashcards?,It identifies the core facts and converts them into a testable Q&A format.,Why is instant generation of revision note cards beneficial?,It allows for rapid, last-minute testing and identification of weak areas.
sat-online,What is the main benefit of creating SAT flashcards online?,Instant access, easy sharing, and integration with online testing and tracking features.,How does AI help achieve a target SAT score?,By ensuring comprehensive coverage of vocabulary and key concepts through efficient study sets.,What sections of the SAT are typically covered by flashcards?,Vocabulary, grammar rules, and math formulas.
quizlet-make-quiz,Why is an AI Flashcard Generator superior to manually creating a quiz on Quizlet?,The AI instantly builds the core content (questions and answers), which can then be formatted into a quiz.,What is the benefit of using flashcards as a foundation for a quiz?,It ensures the quiz questions are atomic and test specific, high-yield facts.,How does AI help students "study smarter" with quizzes?,By rapidly producing randomized, customizable test materials.
asl,What does ASL stand for?,American Sign Language.,What is the primary method of communication in ASL?,Handshapes, movement, location, and non-manual markers (facial expressions).,What are 'non-manual markers' in ASL?,Facial expressions, head tilts, or body postures that convey grammatical information.
study-maker,What is the key feature of a 'Smartest AI Study Flashcard Maker'?,Its ability to accurately parse complex academic PDFs and extract relevant Q&A pairs.,Why should a student use an AI maker over manual methods?,To save hundreds of hours of manual text entry and formatting.,What is the primary goal of the study maker?,To transform passive study materials into active learning tools.
esl,What does ESL stand for in education?,English as a Second Language.,Name a grammatical concept that ESL flashcards often focus on.,Verb tenses, prepositions, or articles.,How does using AI flashcards benefit ESL learners?,It provides structured, rapid review of vocabulary and core grammar rules.
best-website-make,What defines the 'Best Website to Make Flashcards'?,Ease of use, compatibility with various file types (PDF, DOCX), and powerful AI automation.,How does an AI website improve study effectiveness?,By implementing active recall principles directly into the card creation and review process.,What is the main advantage of using a website instead of a local program?,No installation is required, and all data is saved securely in the cloud.
interactive-maker,What defines an 'Interactive Flashcard Maker'?,A tool that allows the user to manipulate, test, and engage with the study cards beyond simple viewing.,How does AI make flashcards interactive?,By generating customizable quizzes, fill-in-the-blanks, or matching games from the core data.,What is the benefit of an interactive study experience?,It increases engagement, motivation, and deepens memory encoding.
best-create,What makes an app the "Best App to Create Flashcards"?,Its ability to convert any document format into high-quality, concise study sets instantly.,Why are AI flashcards superior to manually created cards?,They eliminate human error in transcription and are generated much faster.,What is the core function of a flashcard creation app?,To streamline the conversion of raw information into testable, recall-based units.
website,What is the primary service offered by an 'AI Notecards Website'?,Automated generation of digital study sets from user-uploaded documents.,How does AI revolutionize the creation of study sets on a website?,It uses algorithms to identify key concepts and structure them for active recall.,What is the benefit of using a website for note card generation?,Accessibility, cloud storage, and no software download required.
epa-608,What does EPA 608 certification cover?,Regulations regarding refrigerants, including handling, safety, and recovery practices.,What is the primary goal of the EPA 608 program?,To ensure technicians safely and legally manage refrigerants to protect the ozone layer.,Name one EPA 608 certification type.,Type I (Small Appliances), Type II (High-Pressure), Type III (Low-Pressure), or Universal.
online-study-note,What is an 'Online Study Note Card'?,A digital card derived from study notes, optimized for viewing and testing online.,How does AI create powerful online study note cards?,By condensing verbose notes into concise, testable bullet points.,What is the benefit of reviewing online study note cards?,They are available immediately after creation and can be tracked by a study platform.
multiplication-table,What is the result of 7 times 8?,Fifty-six (56).,What is the purpose of memorizing the multiplication table?,To perform mental math calculations quickly and accurately.,If you multiply any number by 1, what is the result?,The number itself (Identity Property).
french,What is the French word for "house"?,Maison.,How do you say "goodbye" in French?,Au revoir.,Conjugate the verb "être" (to be) for "I am.",Je suis.
cvc,What sound does the 'V' stand for in CVC?,Vowel sound.,What is the purpose of CVC blending flashcards?,To teach children how to combine individual letter sounds into a whole word.,Give a rhyming word for "map.",Cap, lap, tap (Any valid word).
five-senses,Name the five basic human senses.,Sight, hearing, smell, taste, and touch.,Which sense is processed by the eyes?,Sight or vision.,What organ is primarily responsible for the sense of smell?,The nose (specifically, the olfactory receptors).
maker-program,What defines an AI Flashcard Maker Program?,A dedicated software that uses artificial intelligence to convert documents into study decks.,How does the program ensure efficient study workflow?,By automating the tedious setup and allowing immediate focus on active recall.,Why is AI essential for a modern flashcard maker program?,It provides the speed and accuracy needed to handle large academic files.
healthy-food,Name three examples of healthy foods.,Fruits, vegetables, lean protein, whole grains (any three).,What is a primary benefit of eating healthy food?,Improved energy levels, better immune function, and reduced risk of chronic diseases.,What nutrient is the body's main source of energy?,Carbohydrates.
study-note,How does AI transform a general study note into a powerful flashcard?,It extracts the core concept and formats it as a specific, recallable question.,What is the main function of a study note card?,To serve as a prompt for memory retrieval and self-testing.,Why is instant generation of study note cards effective?,It allows students to test themselves immediately after writing or reading the source material.
stationery,What is the main disadvantage of using physical flash cards stationery?,They are difficult to organize, not easily searchable, and lack automated review systems.,What type of student typically uses flash card stationery?,Students who prefer tactile learning and manual writing.,How does AI replace flash cards stationery for serious students?,It offers digital, scalable, and systematic study tools without the manual labor.
times-table,What is the result of 9 times 6?,Fifty-four (54).,If you multiply 10 by any number, what will the resulting number always end in?,Zero (0).,What is the product of 11 x 11?,121.
shichida,What is the primary method used in Shichida Education?,High-speed flashcard (flashing) presentation and visual memory training.,What is the supposed goal of Shichida's method?,To maximize a child's brain potential, particularly the right brain's photographic memory.,What age group is typically targeted by Shichida flashcards?,Infants and very young children (early childhood education).
best-creating,Why is AI considered the 'Best App for Creating Flashcards'?,It offers unparalleled speed and accuracy in converting notes to testable study sets.,How does the app improve upon manual creation methods?,By eliminating the need to type out questions, answers, and formatting.,What is the key benefit of creating flashcards from your own study materials?,The relevance and context of the cards are perfectly matched to your exam requirements.
telling-time,How many minutes are in "half past" the hour?,Thirty (30) minutes.,If it is 3:00 PM, what time will it be in one hour?,4:00 PM.,What is the term for 15 minutes past the hour?,Quarter past (or quarter after).
flash-cards-pdf,What is the key technology used to extract text from a PDF for flashcards?,Optical Character Recognition (OCR).,How does the AI Flash Cards PDF Generator help with concept mastery?,It converts dense, passive text into active, testable questions.,Why is the instant conversion of a PDF to flash cards valuable?,It saves immense time over manually transcribing the PDF content.
ncert,What does NCERT stand for in the Indian education system?,National Council of Educational Research and Training.,What is the primary role of NCERT textbooks?,To provide the standard curriculum and resources for schools affiliated with the CBSE board.,How does AI help master NCERT concepts?,By instantly generating flashcards from the text, aiding active recall of syllabus facts.
