slug,question_1,answer_1,question_2,answer_2,question_3,answer_3
goodnotes,What is the main function of the 'Lasso Tool' in GoodNotes?,To select, move, resize, or delete handwritten notes and images.,Why is converting GoodNotes notes to AI flashcards smart?,It automates the transformation of passive notes into an active study system.,How does GoodNotes facilitate digital organization?,By allowing users to create custom digital notebooks and folders.
nelson-denny-vocabulary,Define the vocabulary word 'alacrity.',Brisk and cheerful readiness; eagerness.,What does the word 'perfidious' mean?,Deceitful and untrustworthy.,Give a synonym for the Nelson Denny word 'esoteric.',Obscure, cryptic, or known only to a specialized few.
medstudy-internal-medicine,What is the standard treatment for uncomplicated community-acquired pneumonia (CAP)?,Usually amoxicillin or doxycycline, depending on local resistance patterns and patient factors.,What common lab test is used to assess kidney function?,Creatinine and BUN (Blood Urea Nitrogen).,Define the term 'ascites.',The accumulation of fluid in the peritoneal cavity, often associated with liver failure.
vocabulary-english,Define 'pensive.',Engaged in or reflecting deep or serious thought.,What does the prefix 'anti-' usually mean?,Against or opposite.,Write a sentence using the word 'meticulous.',The scientist was meticulous in recording the data.
nihongo-notion,What is the name of the phonetic script used for Japanese words of foreign origin?,Katakana.,What is a 'kanji' character?,A Japanese writing system symbol borrowed from Chinese, representing entire words or concepts.,What is the purpose of the particle 'wa' (は) in a Japanese sentence?,It marks the topic of the sentence.
magoosh,How does AI benefit students using Magoosh study materials?,It rapidly converts long-form text or video transcripts into concise, reviewable flashcards.,What is the key to mastering high-stakes exams like the GRE or GMAT?,Consistent practice and effective use of active recall and spaced repetition.,What are Magoosh's primary offerings?,Online test prep courses and practice questions for standardized exams.
medical-student-anki,Why do medical students rely heavily on Anki?,Its Spaced Repetition System (SRS) is highly effective for memorizing the vast amount of information required.,What is the primary challenge for medical students using Anki?,The time required for manual card creation and maintaining a large card volume.,What is the "Zanki" or "AnKing" deck?,Large, pre-made Anki decks containing thousands of cards covering the medical school curriculum.
note-online-study,What is the main purpose of an online note card?,To serve as a digital tool for reviewing key facts using the active recall method.,How does AI assist in the creation of online note cards?,It automatically extracts structured content from uploaded study documents.,Why is reviewing note cards online often more efficient than using paper cards?,Online systems provide searchability, organization, and often include built-in SRS algorithms.
medstudy,What is the primary audience for MedStudy materials?,Physicians, residents, and medical students preparing for internal medicine or pediatrics board exams.,Why are flashcards crucial for MedStudy content review?,The sheer volume of material necessitates efficient, high-yield review using active recall.,What is a common feature of MedStudy materials?,They summarize complex medical topics into focused, board-relevant learning points.
food-vocabulary,What is the vocabulary term for the act of chewing food?,Mastication.,What word describes food that tastes sharp, sour, or acidic?,Tangy or tart.,Name a food item that is an excellent source of fiber.,Oats, beans, whole grains, or most vegetables.
make-online,What is the primary advantage of making flashcards online versus offline?,Accessibility: they can be studied anywhere on any device with an internet connection.,How does AI ensure speed when making online flashcards?,It automates the text extraction and formatting steps, bypassing manual typing.,What is the definition of a 'digital study deck'?,A collection of electronically created and managed flashcards used for online learning.
modern-real-estate-practice-20th-edition,What is 'agency' in real estate?,The fiduciary relationship between a principal (client) and an agent (broker).,Define the term 'encumbrance.',A claim, charge, or liability that affects or limits the title to property.,What is the purpose of a deed?,A legal document that officially transfers ownership of real property from one party to another.
make,What is the primary benefit of creating your own flashcards?,The cognitive process of summarizing and phrasing the material reinforces learning.,How does an AI app assist in making your own flashcards?,It uses your uploaded content to instantly suggest questions and answers, speeding up the process.,What is the definition of a 'study guide'?,A document or tool designed to help organize and review information for an exam or topic.
past-simple-irregular-verbs,Give the Past Simple form of the verb 'run.',Ran.,What are the Past Simple and Past Participle forms of 'begin'?,Began, Begun.,Form a question using an irregular verb in the Past Simple tense.,Did you see that movie yesterday?
possessive-pronouns,Give three examples of possessive pronouns.,Mine, yours, his, hers, ours, theirs (any three).,What question does a possessive pronoun answer?,Whose is it?,Write a short sentence using the possessive pronoun 'theirs.',That car is theirs.
quizlet-make-private,What is the benefit of generating flashcards from a PDF using AI?,It instantly converts structured text into Quizlet-ready study sets, saving manual input time.,Why do students often need to create private study sets?,To review copyrighted or specific class materials without sharing them publicly.,How does AI ensure accurate information extraction from a document?,It uses advanced text recognition to identify headers, terms, and definitions.
personal-pronouns,Name the three cases of personal pronouns.,Nominative (subject), Objective (object), and Possessive.,Give two examples of first-person plural pronouns.,We, us, ours.,What is the function of an objective personal pronoun?,It receives the action of the verb (e.g., "Give the book to me").
power-up-1,What is the likely subject matter of "Power Up 1" flashcards?,It often refers to foundational or introductory material in a specific curriculum (e.g., language or math basics).,Why are flashcards effective for Power Up 1 content?,They target the rapid memorization of foundational vocabulary or basic skills.,What is the typical age group for a "Power Up 1" level curriculum?,Often early elementary or beginner language learners.
food-drinks,Name two common beverages that contain caffeine.,Coffee, tea, and soda (any two).,What is the primary difference between a fruit juice and a smoothie?,Juice is extracted liquid; a smoothie is blended whole fruit/vegetables.,What drink is made from fermented grapes?,Wine.
months,How many months have exactly 30 days?,Four (April, June, September, November).,Which month comes before October?,September.,Which month is the shortest in terms of days?,February.
quizlet-make,Why is using AI a "smarter" alternative to manually making Quizlet sets?,AI automates the creation of cards, ensuring better quality and much faster setup time.,What is the main task AI bypasses when creating Quizlet sets?,The manual typing and formatting of question/answer pairs from notes.,What is a "study mode" on a flashcard platform?,A specific way to interact with the cards, such as "Learn," "Match," or "Test."
recycling,What are the three R's of waste management?,Reduce, Reuse, Recycle.,Name one common material that can be recycled.,Paper, plastic, glass, or aluminum.,What does the recycling symbol (mobius loop) indicate?,That the material is capable of being recycled, but not necessarily that it will be.
picture,What is a 'Picture Card' primarily used for?,To connect a visual image with a vocabulary word, concept, or term, aiding non-verbal memory.,How does AI help generate Picture Cards from PDFs?,AI extracts the text and uses it to find contextually relevant images or diagrams.,Why are visual aids essential for early childhood education?,They provide concrete examples for abstract concepts and aid in language acquisition.
preposition-picture,What is a preposition?,A word governing a noun or pronoun, expressing a relation to another word (e.g., "in," "on," "under").,Give an example of a common preposition of location.,Under, above, beside, or next to.,How do picture cards help teach prepositions?,They visually demonstrate the spatial relationship described by the preposition (e.g., "the ball is *under* the box").
fundations-digraph-sound,What is a digraph in phonics?,Two letters that combine to make a single sound (e.g., 'sh', 'ch', 'th').,Give an example of a word with the 'sh' digraph sound.,Ship, wish, brush (Any valid word).,What is the purpose of Fundations sound cards?,To provide consistent, structured practice for phoneme-grapheme correspondences in early literacy.
phoneme,What is a phoneme?,The smallest unit of sound that can distinguish one word from another (e.g., /p/ in 'pat').,How many phonemes are generally recognized in the English language?,Around 44, though this varies by dialect.,Give an example of two words that differ by only one phoneme.,Cat and Bat (differ by the initial phoneme).
physical-appearance,What term describes a person who is short and heavy?,Stocky or stout.,Name three characteristics used to describe hair.,Color, length, and texture (e.g., straight, curly, wavy).,What is the opposite of 'slender'?,Heavy, stout, or plump.
python,What is the primary use of Python in the tech industry?,Web development, data science, automation, and machine learning.,What does 'indentation' signify in Python code?,It defines a block of code (like a loop or function body).,What is a 'list' in Python?,A mutable, ordered sequence of elements.
planet,Name the largest planet in our solar system.,Jupiter.,Which planet is known as the "Red Planet"?,Mars.,What is the closest planet to the Sun?,Mercury.
quizlet-game-create,How does AI streamline the creation of study games?,It instantly generates the foundational question/answer pairs needed for any game mode.,Why do students prefer game-based study over simple flashcards?,Games add an element of fun, competition, and time pressure, enhancing engagement.,What is the function of a 'Quizlet Game Create' feature?,It allows users to quickly format their study sets into interactive game formats.
right-brain-education,What is the focus of Right Brain Education methods?,To stimulate the brain's visual, intuitive, and holistic processing capabilities, often for early learning.,What type of learning material is commonly used in Right Brain Education?,High-speed flashcards (flashing), memory grids, and visual imagery exercises.,Why is high-speed flashing used in this method?,To train the brain to absorb information quickly without conscious filtering.
tagalog,What is the Tagalog word for "yes"?,Oo.,How do you say "good morning" in Tagalog?,Magandang umaga.,What is the official name of the Filipino language?,Filipino (based on Tagalog).
smartserve-quizlet,What is SmartServe certification for?,It is mandatory training in Ontario, Canada, for serving or selling alcohol responsibly.,Why is using AI flashcards superior to generic SmartServe Quizlet searches?,AI ensures the material is high-quality, up-to-date, and specifically focused on the key regulatory concepts.,What is a key concept covered in SmartServe training?,Recognizing signs of intoxication and understanding legal liabilities.
transport,Name three common forms of public transport.,Bus, train, subway/metro, taxi (any three).,What is the definition of 'commute'?,To travel some distance between one's home and place of work or study on a regular basis.,What method of transport relies on sails or an engine on water?,Boat or ship.
tricky,What makes a word a "Tricky Word" in phonics instruction?,It contains spelling patterns that do not follow standard phonetic rules (i.e., irregular spellings).,Give an example of a common tricky word.,Said, was, the, have (Any word with an irregular sound-spelling link).,Why do students need targeted flashcards for tricky words?,To practice instant recognition, as decoding them phonetically is difficult or impossible.
urdu-alphabets,How many letters are typically in the Urdu alphabet (Abjad)?,39 letters.,What is the main script used to write Urdu?,The Perso-Arabic script (Nastaʿlīq style).,Which direction is Urdu script written?,From right to left.
vehicle,Name three types of land vehicles.,Car, truck, bicycle, bus, motorcycle (any three).,What is the part of a vehicle that holds the fuel?,The fuel tank.,What term is used for a vehicle used to transport goods?,Lorry or truck.
verb,What is the main function of a verb in a sentence?,To express an action, occurrence, or state of being.,What are the three main types of verbs?,Action, Linking, and Helping (Auxiliary) verbs.,Give an example of a linking verb.,Be, seem, become, feel (any one).
weather,Name three common types of precipitation.,Rain, snow, sleet, hail (any three).,What instrument is used to measure air temperature?,Thermometer.,What is a swift, localized, violently rotating column of air?,Tornado.
winter-sports,Name three popular winter sports.,Skiing, snowboarding, ice hockey, figure skating (any three).,What piece of equipment is essential for ice skating?,Skates.,What is the winter sport that involves sliding down a track feet-first on a small sled?,Luge or Skeleton.
time,How many seconds are in one minute?,Sixty (60).,What are the two common formats for telling time?,12-hour clock (AM/PM) and 24-hour clock (Military time).,What unit of time is equivalent to 60 minutes?,One hour.
quizlet-create-set,Why does AI creation of study sets beat manual 'Quizlet Create A Set'?,AI performs the extraction, formatting, and typing instantly, maximizing study time.,What is the first step in creating an AI flashcard set?,Uploading your source document (PDF, notes, or text).,How does AI improve the quality of a generated study set?,It ensures consistent formatting and extracts only the most salient information.
sat-vocabulary-online,Define the vocabulary word 'malleable.',Capable of being shaped or extended; easily influenced.,What does the SAT word 'perfunctory' mean?,Carried out with a minimum of effort or reflection; superficial.,Why is online study often preferred for SAT vocabulary?,Online tools allow for instant self-testing and often integrate spaced repetition systems.
good-notes,What is a "Good Note" in the context of studying?,A high-quality, organized, and thorough set of revision notes.,How does AI transform good notes into active study tools?,It identifies key terms and converts them into question-answer format.,Why is note review crucial for exam preparation?,It solidifies understanding and transfers information from short-term to long-term memory.
telugu,What is the script used to write the Telugu language?,The Telugu script (an Abugida).,How do you say "hello" in Telugu (informal greeting)?,Namaskaram or Namaste.,What is the name of the most widely spoken language family that Telugu belongs to?,Dravidian languages.
good-note,What is the main benefit of using a "Good Note" for flashcard generation?,The content is already structured and well-written, leading to higher-quality AI extraction.,How can a student ensure their notes are "flashcard-ready"?,By using clear headings, bolding key terms, and writing concise definitions.,What is the ultimate goal when converting notes to flashcards?,To transition from passive reading to active, tested recall.
quizlet-make-set,How does AI eliminate the hassle of manually building a Quizlet set?,It reads the source document and automatically creates all the individual flashcards.,What is the main downside of manual set creation?,It is time-consuming and tedious, often leading to procrastination.,What study technique does AI-generated material support best?,Active Recall and Spaced Repetition.
uworld,What is UWorld primarily used for by students?,As a high-quality question bank (QBank) for medical licensing exams (USMLE, COMLEX) and other standardized tests.,Why are flashcards generated from UWorld text useful?,They isolate the high-yield concepts and explanations found within the QBank rationales.,What does 'QBank' stand for?,Question Bank.
vocab-maker,What is the main function of a vocab flashcard maker?,To quickly and accurately convert a list of words and definitions into a study deck.,How does AI speed up vocabulary acquisition?,By generating study material instantly, allowing more time for actual memorization practice.,What feature makes an AI vocab maker 'smart'?,Its ability to automatically extract definitions from context or link to online dictionaries.
quizlet-create,What is the AI alternative to manually creating your own Quizlet flashcards?,Uploading a document and letting the AI extract the Q&A pairs instantly.,Why is it better to use AI for creation than the standard Quizlet tools?,AI handles large volumes of text much faster, minimizing manual labor.,What is the benefit of making your own study material, even with AI?,It ensures the content is precisely tailored to your specific course or exam.
make-vocabulary,How do you initiate the process of making vocabulary flashcards with AI?,Upload a document (PDF, notes) containing the words you need to learn.,Why is context important when making vocabulary cards?,Context helps you understand *how* to use the word, not just its definition.,What is the key metric for effective vocabulary study?,Retention rate, measured by successful recall during testing.
online-maker,What is the primary benefit of an AI Online Flashcard Maker?,It is accessible from any device, anytime, with no software installation required.,How does AI generate study decks from raw material?,It identifies text structure, separates terms from definitions, and formats them into cards.,What is a "study deck" in this context?,A digital collection of flashcards focused on a single topic or exam.
ardms-abdomen-quizlet,What does ARDMS stand for in medical imaging?,American Registry for Diagnostic Medical Sonography.,What is the key to passing the ARDMS Abdomen exam?,Mastering the anatomy, physiology, and pathology of the abdominal organs.,Name one organ typically imaged during an ARDMS Abdomen exam.,Liver, gallbladder, kidneys, spleen, pancreas (any one).
online-creator,What is the main advantage of an AI online flashcard creator?,The speed of converting dense documents into structured, reviewable study material.,What is 'Active Recall'?,A study method where you force your memory to retrieve information rather than passively reviewing it.,How does the creator help serious students?,It maximizes study efficiency by automating the most time-consuming step: card creation.
maker,What input formats can a modern AI flashcard maker process?,PDF, DOCX, simple text, or handwritten notes (via OCR).,What is the 'Ultimate' benefit of an AI maker for complex material?,It identifies and isolates the most critical terms and concepts from dense, long documents.,What is the goal of converting documents to study cards?,To transform passive reading material into an active testing tool.
creator,How does the AI Flashcard Creator save students time?,By instantly reading and structuring notes into question-answer format.,What makes an AI Creator the "fastest" option?,Its ability to process hundreds of pages in seconds.,What is the primary output of the AI Creator?,A digital study deck ready for immediate active recall practice.
best-maker,What criterion makes an AI tool the 'Best Flashcard Maker App'?,Accuracy of extraction, speed of generation, and integration with effective study techniques (SRS).,How does AI enhance the study process beyond just creation?,By organizing the material and often suggesting review schedules based on Spaced Repetition.,Why is an app better than a website for some students?,An app often provides better offline access and native mobile features.
generator,What is the fundamental role of an AI Flashcard Generator?,To use machine learning to extract and format key information from source documents.,What type of input is ideal for a fast AI generator?,Structured text like notes or textbooks with clear headings and definitions.,How does an intelligent generator handle complex materials?,It focuses on definitional sentences and bolded terms to create concise Q&A pairs.
months-year,Name the 12 months of the year in order.,January, February, March, April, May, June, July, August, September, October, November, December.,How many days does the month of June have?,Thirty (30).,Which month is the mid-point of the calendar year?,July.
study-notes,What is the difference between study notes and flashcards?,Notes are comprehensive summaries; flashcards are atomic, testable units of information.,How does AI transform study notes into effective learning tools?,By segmenting the notes and reformulating the content into questions and answers.,What is the benefit of generating flashcards instantly from notes?,It allows immediate testing of the material while the concepts are still fresh.
fema-ics-200-quizlet,What does ICS stand for in FEMA training?,Incident Command System.,What is the purpose of ICS 200?,To provide training for personnel who may be required to function in a supervisory role within the ICS structure.,Name one key component of the ICS organizational structure.,Command Staff, General Staff, or Incident Commander.
beginning-sound-picture,What is the 'beginning sound' of a word?,The first phoneme or sound heard when saying the word (e.g., /b/ in 'ball').,How do picture flashcards aid in learning beginning sounds?,The picture provides a concrete visual cue for the word, isolating the initial sound.,Give a word that begins with the sound /m/.,Mouse, map, milk (Any valid word).
api-570,What is the scope of API 570 in the petrochemical industry?,Inspection, repair, alteration, and re-rating of in-service piping systems.,What qualification is required to perform API 570 inspections?,Certified Piping Inspector.,What is the primary concern addressed by API 570 inspections?,Ensuring the mechanical integrity and continued safe operation of the piping.
zoo-animals,Name three animals commonly found in a zoo.,Lion, tiger, elephant, giraffe (any three).,What is a zoo?,An establishment that maintains a collection of wild animals, typically in a park or gardens, for study, conservation, or public exhibition.,What is the term for a baby kangaroo?,Joey.
servsafe-7th-edition-quizlet,What is the 'Danger Zone' temperature range for food safety?,41°F to 135°F (5°C to 57°C).,What is the primary purpose of ServSafe certification?,To train food handlers and managers on safe food practices to prevent foodborne illness.,What does 'TCS food' stand for?,Time/Temperature Control for Safety food.
servicenow-cis-itsm-quizlet,What does ITSM stand for in the context of ServiceNow?,IT Service Management.,What is the core function of ServiceNow?,A cloud-based platform for managing IT infrastructure and business processes via digital workflows.,Name one key process within ITSM.,Incident Management, Problem Management, or Change Management.
tamil,What is the script used to write the Tamil language?,Tamil script.,How do you say "hello" in Tamil?,Vanakkam (வணக்கம்).,What is the term for the vast literary tradition of the Tamil language?,Sangam literature.
tefl,What does TEFL stand for?,Teaching English as a Foreign Language.,What is the main difference between TEFL and TESOL?,TEFL focuses on teaching non-native speakers in non-English speaking countries; TESOL is broader.,What is 'TPR' (Total Physical Response) in language teaching?,A method where students respond physically to verbal commands to aid comprehension.
quizlet,How does AI help users who previously relied on manual Quizlet creation?,It automates the process of turning PDFs into ready-to-study flashcards.,Why is manual flashcard making from PDFs inefficient?,It requires tedious copying, pasting, and formatting of text.,What is the benefit of generating study sets directly from course materials?,The flashcards are guaranteed to be relevant to the specific exam or curriculum.
sites-like-quizlet,What common feature do flashcard sites like Quizlet share?,They offer digital tools for creating, studying, and sharing user-generated flashcard sets.,Why are AI flashcard sites considered an upgrade from traditional platforms?,They automate the card creation process, saving significant time over manual entry.,What is the main disadvantage of relying solely on user-generated content (like on Quizlet)?_?,The content quality and accuracy can be highly inconsistent.
canva-maker,What is Canva primarily used for?,Graphic design, creating visual content, and document layout.,How does an AI Canva Flashcards Maker function?,It extracts content from a document and uses Canva's design tools to create visually appealing flashcards.,Why would a student use Canva for flashcards?,To make the study material more engaging and visually memorable.
evernote,What is Evernote primarily used for?,Digital note-taking, clipping web pages, and organizing research materials across devices.,How can AI convert Evernote notes into flashcards?,It analyzes the note's structure, extracts key points, and reformats them into Q&A pairs.,What is the benefit of synchronizing study sets with Evernote?,It keeps study materials organized alongside original research notes.
