slug,question_1,answer_1,question_2,answer_2,question_3,answer_3
colors,What are the three primary colors of light?,Red, Green, and Blue (RGB). Mixing them creates white light.,Define 'hue' in color theory.,Hue is the pure spectrum color, like red, yellow, or blue, that determines the family of the color.,What color results from mixing blue and yellow?,The result of mixing blue and yellow pigment is green. This is a secondary color.
vowel,Name the five main English vowel letters.,A, E, I, O, U. They represent sounds produced with an open vocal tract.,Give an example of a word with a long 'A' sound,"Cake" or "Name." The long vowel sound typically says the letter's name.,What sound does the short 'E' make?,The short 'E' makes the sound heard in words like "bed" or "egg."
maker-pictures,Why do visuals boost memory retention?,The Picture Superiority Effect states that images are recalled better than words. Visuals aid active recall.,What is a 'visual study set'?,A study set where each card includes relevant images or diagrams alongside the text prompt.,How can AI generate relevant pictures for complex terms?,AI searches for contextually relevant images based on the definition or term provided in the flashcard text.
create-quizlet,What is the main benefit of using AI for flashcard creation?,It dramatically reduces the time spent on manual data entry, letting you focus on studying and active recall.,Name one drawback of traditional manual flashcard creation.,It is time-consuming and often involves tedious retyping or copy-pasting from notes.,How does AI ensure accuracy when creating study sets?,AI extracts key terms and definitions directly from the provided source document or PDF.
digital-maker,What defines a 'digital flashcard maker'?,A tool that generates, stores, and organizes study material electronically, usually accessible via web or app.,What is Active Recall?,A study technique where you stimulate memory retrieval by asking questions instead of passively reading notes.,How does AI improve the digital study experience?,AI automates deck creation, formats material, and often incorporates spacing and review schedules.
anki-english,What is the function of the 'Morpheme' in vocabulary?,A morpheme is the smallest unit of language that carries meaning (e.g., prefixes, root words).,Define the term 'collocation.',A natural combination of two or more words, like "heavy rain" instead of "strong rain.",In Anki, what principle governs card review frequency?,Spaced Repetition System (SRS). This algorithm shows you cards right before you are about to forget them.
1-10,How many fingers are typically on two human hands?,Ten.,Write the number seven as a word.,Seven.,If you have 4 apples and I give you 3 more, how many do you have?,You have 7 apples (4 + 3 = 7).
free-notecards,What is the purpose of a notecard in studying?,Notecards are tools used for summarizing key information, often using a question/answer format for review.,How does AI generation save time for students?,AI instantly extracts definitions and concepts from documents, eliminating the need for manual transcription.,What is the difference between a note and a flashcard?,Notes capture information passively; flashcards present information actively for testing and recall.
sat-vocabulary,Define the word 'ubiquitous.',Existing or being everywhere at the same time; constantly encountered.,What does the term 'sycophant' mean?,A person who acts excessively obedient toward someone important in order to gain advantage; a flatterer.,Use the SAT word 'prosaic' in a short sentence.,The film critic described the plot as predictable and prosaic.
sight,Why are sight words important for beginning readers?,They are high-frequency words that often cannot be sounded out using basic phonetic rules.,Give three examples of common sight words.,The, and, is, was, said (Any three common, non-phonetic words).,What is the goal of teaching sight words?,To enable children to recognize words instantly and automatically, increasing reading fluency.
create,How does creating flashcards actively aid learning?,It forces you to synthesize and condense complex information into concise, retrievable chunks.,What type of material is best converted into flashcards?,Definitions, formulas, dates, vocabulary, and specific facts that require rote memorization.,What is the main advantage of using an AI app to create cards?,Speed and volume. You can convert hours of reading material into study sets in minutes.
bicsi-rcdd,What does RCDD stand for in the context of BICSI certification?,Registered Communications Distribution Designer.,Name a key standard used in telecommunications design.,TIA/EIA standards, such as TIA-568 (Commercial Building Telecommunications Cabling Standard).,What is the primary purpose of a Telecommunications Closet (TC)?,To house the distribution frames, horizontal cross-connects, and equipment for a specific area of the building.
shapes,How many sides does a hexagon have?,A hexagon has six sides and six vertices.,Define the geometric term 'radius.',The distance from the center point of a circle or sphere to any point on its boundary.,What is a polygon?,A closed two-dimensional shape made up of straight line segments joined end-to-end.
days-week,Which day of the week follows Thursday?,Friday.,How many days are there in a standard week?,There are seven days in a standard week.,Name the first day of the working week in many Western cultures.,Monday.
brown-bear,What is the scientific name for the brown bear species?,Ursus arctos.,Where are brown bears predominantly found?,North America, Europe, and Asia. Alaskan and Russian populations are significant.,What is the typical diet of a brown bear?,They are omnivores, eating berries, roots, insects, fish (especially salmon), and large mammals.
easy-maker,What feature makes a flashcard maker "easy"?,Minimal manual input, intuitive interface, and rapid conversion from source material (like PDF) to cards.,Why is converting documents fast essential for busy students?,It maximizes study time by eliminating the labor-intensive process of manual note extraction and typing.,What is a 'study set'?,A collection of related flashcards, notes, or quiz questions grouped by topic or unit.
flip-maker,What is the primary function of a flip card?,To facilitate active recall by requiring the user to recall information before flipping to reveal the answer.,How do digital flip cards differ from paper ones?,Digital cards allow for instant sorting, searching, and integration with Spaced Repetition Systems (SRS).,What information should be placed on the front side of a flip card?,A specific question, key term, or image prompt.
spanish,What is the Spanish word for "hello"?,Hola.,Conjugate the verb "hablar" (to speak) in the present tense for "I.",Yo hablo.,What Spanish term is used for "thank you"?,Gracias.
science,What is the definition of a hypothesis?,A proposed explanation or educated guess based on limited evidence, meant for further investigation.,Name the three primary states of matter.,Solid, liquid, and gas.,What is Newton's First Law of Motion (Law of Inertia)?,An object in motion stays in motion, and an object at rest stays at rest, unless acted upon by an outside force.
lange-pathology,Define the medical term 'etiology.',The cause or set of causes for a disease or condition.,What is necrosis?,The pathological death of cells or tissues, often due to injury, infection, or lack of blood supply.,What is the main difference between acute and chronic inflammation?,Acute inflammation is immediate and short-term; chronic inflammation is prolonged and involves persistent tissue destruction.
action,Provide three examples of common action verbs.,Run, jump, eat, think, write (any three valid verbs).,What role do action flashcards play in language learning?,They help visually connect a verb (the word) with the activity it describes, aiding comprehension.,How does an action verb function in a sentence?,It describes an action performed by the subject of the sentence.
4-seasons,Name the four seasons in order, starting with Spring.,Spring, Summer, Autumn (or Fall), Winter.,What causes the change in seasons on Earth?,The tilt of the Earth's axis (axial tilt) relative to its orbit around the Sun.,Which season is characterized by the shortest days in the Northern Hemisphere?,Winter.
ap-biology,What is the primary function of the mitochondria?,Cellular respiration: generating the majority of the cell's supply of ATP (energy).,Define 'osmosis.',The passive movement of water molecules across a selectively permeable membrane toward a higher solute concentration.,What does PCR stand for in molecular biology?,Polymerase Chain Reaction. It is used to amplify DNA sequences.
adjective,What part of speech does an adjective modify?,Nouns and pronouns.,Give an example of an adjective of quantity.,Many, few, several, or numerous.,Write a short sentence using a comparative adjective.,My house is larger than yours.
clothes,What is the term for a long, heavy coat worn in cold weather?,An overcoat or parka.,Name three items of clothing worn on the upper body.,Shirt, jacket, sweater, blouse, t-shirt (any three).,What are 'accessories' in the context of clothes?,Items worn or carried to complete an outfit, such as jewelry, hats, scarves, or belts.
create-study-online,Why should students use online tools for study prep?,Online tools offer flexibility, organization, and automated features like AI generation and review tracking.,What is the typical process for converting a PDF to online flashcards?,Upload the document, allow the AI to extract material, and then review/edit the generated study set.,What is the key advantage of digital study organization?,All study materials are centrally located, searchable, and accessible across multiple devices.
cantonese,What is "thank you" in Cantonese (for a service)?,M̀h'gōi (唔該).,How do you say "good morning" in Cantonese?,Jóu-sahn (早晨).,In Cantonese, what is the meaning of the tone marker '6' (low falling)?,It denotes a low-pitch contour that falls slightly or remains low (e.g., in a six-tone system).
bedroom,Name three common pieces of furniture found in a bedroom.,Bed, dresser, nightstand, closet (any three).,What is a 'comforter'?,A thick, quilted blanket used on a bed for warmth.,What word describes the small table next to a bed?,Nightstand or bedside table.
create-anki-quickly,Why is speed crucial when creating Anki decks?,Faster creation maximizes the time available for actual studying and active recall testing.,What format does Anki use to organize its study material?,It uses 'Notes' which contain 'Fields,' which are then rendered into 'Cards.',How can AI minimize formatting errors in Anki cards?,AI handles the initial text cleanup and proper field separation before export.
counting,If you count from 1 to 10, what number comes after 8?,Nine.,What is the result of 5 plus 2?,Seven (7).,What number represents having nothing?,Zero (0).
community-helpers,Name a community helper whose job involves putting out fires.,Firefighter.,What is the primary job of a police officer?,To enforce laws, protect citizens, and respond to emergencies.,Who works at a school to educate children?,Teacher.
activities,Name three common outdoor activities.,Running, hiking, cycling, playing sports (any three).,What activity involves quiet reading and research?,Studying.,What is the term for the activity of moving your body to music?,Dancing.
consonant-blends,Define a consonant blend (or cluster).,A group of two or three consonants where each sound is still distinct and audible (e.g., 'bl' in black).,Give an example of a word starting with the blend 'st.',Stop, star, stamp (Any valid word).,What is the difference between a blend and a digraph?,In a blend, you hear both sounds (s-t); in a digraph, two letters make one new sound (sh, ch).
class-10,What is the formula for calculating kinetic energy?,KE = ½mv² (mass times velocity squared).,Name the process where plants convert light energy into chemical energy.,Photosynthesis.,What is the SI unit of electric current?,The Ampere (A).
barrons-ap-statistics,What is the p-value used for in hypothesis testing?,It measures the probability of observing data as extreme as or more extreme than the null hypothesis.,Define a Type I error.,Rejecting the null hypothesis when it is, in fact, true (False Positive).,What does the acronym 'DOGS' stand for when describing quantitative data?,Direction, Outliers, Gaps, and Shape.
countries,Name the continent where Brazil is located.,South America.,What is the capital city of France?,Paris.,Which country is known for the Great Wall?,China.
ap-psychology,What is the definition of classical conditioning?,Learning through association, where a neutral stimulus becomes associated with an unconditioned stimulus.,Name the "Big Five" personality traits.,Openness, Conscientiousness, Extraversion, Agreeableness, Neuroticism (OCEAN).,What is the function of the amygdala?,It plays a primary role in processing memory, decision-making, and emotional responses (fear and pleasure).
cvc-blending,What does the acronym CVC stand for in phonics?,Consonant-Vowel-Consonant.,Give an example of a CVC word.,Cat, dog, sun, hop (Any valid three-letter word with this pattern).,When blending "h-a-t," what sound does the middle letter make?,The short 'a' sound (like the sound in "apple").
days-week-kindergarten,What day do you usually start school after the weekend?,Monday.,Say the days of the week out loud.,Sunday, Monday, Tuesday, Wednesday, Thursday, Friday, Saturday.,Which day comes right before Saturday?,Friday.
esl-adults,What is a modal verb? Give an example.,A helping verb (like can, could, might) used to express necessity, possibility, or obligation.,Form the Past Simple tense of the verb "go.",Went.,What is the difference between "affect" and "effect"?, "Affect" is usually a verb (to influence); "effect" is usually a noun (a result).
english-vocabulary,Define 'ephemeral.',Lasting for a very short time; transient.,What does the root word 'bene' mean?,Good or well.,Give a synonym for the word 'proficient.',Skilled, expert, or competent.
directions,If you are facing North and turn right, which direction are you facing?,East.,What direction is the opposite of West?,East.,What word do you use to ask for location instructions?,Directions.
animals,Name three major classes of vertebrates.,Mammals, birds, reptiles, amphibians, and fish (any three).,What is a mammal known for its pouch?,Marsupial (e.g., kangaroo, opossum).,What characteristic distinguishes birds from other animals?,They have feathers and lay hard
-shelled eggs.
download-from-quizlet,What is the typical issue with transferring data from platforms like Quizlet?,It often requires manual copy-pasting or dealing with inconsistent export formats, which is time-consuming.,How does AI simplify the process of importing study material?,AI can extract and structure data from raw text or PDFs, bypassing platform-specific export issues.,Why is manual data entry inefficient for large study decks?,It is highly prone to errors and takes away valuable time that could be used for active study.
irregular-verbs,Give the Past Simple and Past Participle forms of the verb 'sing.',Sang, Sung.,What are the three main forms of an irregular verb?,Base form (infinitive), Past Simple, and Past Participle.,Form a sentence using the irregular verb 'drive' in the Past Simple tense.,Yesterday, I drove to the store.
days-months,How many months are in one year?,Twelve (12).,Which month is the last month of the year?,December.,What are the names of the two major time periods we use to measure time?,Days and Months.
family-members,What is your mother's brother called?,Uncle.,What do you call the daughter of your sibling?,Niece.,What is the term for a grandparent's parent?,Great-grandparent.
filipino-alphabet,How many letters are in the modern Filipino Alphabet (Abakada)?,Twenty-eight (28) letters.,Name two letters unique to the Filipino Alphabet.,Ñ (enye) and Ng (nga).,What is the term for the entire set of letters in the Filipino language?,Abakada.
esl-action-verbs,What is the action verb in the sentence: "The cat quickly jumped.",Jumped.,Give an example of an action verb related to movement.,Walk, run, hop, skip, crawl (any one).,What category of verbs describes mental actions?,Cognitive verbs, such as think, imagine, or remember.
english-verbs,What is the base form of the verb 'was'?,Be.,What are the two main types of verbs in English grammar?,Action verbs and Linking verbs.,What is a phrasal verb?,A verb combined with an adverb or preposition to create a new meaning (e.g., 'look up').
family,Define the term 'nuclear family.',A unit consisting of two parents and their children (immediate family).,What term describes a relative who is not immediate (e.g., uncle, cousin)?,Extended family member.,What is 'foster care'?,A system where a child is placed in a government-certified family for temporary care.
flags-world,Which country's flag is known as the "Stars and Stripes"?,The United States of America.,What is the color combination on the flag of Italy?,Green, white, and red (vertical stripes).,Which country features a large red circle on a white background?,Japan.
learning-english,What is an 'adverb'?,A word that modifies a verb, an adjective, or another adverb.,How do you form the plural of most English nouns?,By adding -s or -es to the singular form.,What is 'comprehension' in the context of learning English?,The ability to understand the meaning or importance of something that is read or heard.
feelings,Name three basic human feelings.,Joy, sadness, anger, fear, surprise (any three).,What feeling is the opposite of sadness?,Happiness or joy.,What emotion is associated with anticipating danger?,Fear.
download,What is the primary function of a PDF in an academic setting?,To maintain the fixed formatting of a document across different operating systems and viewers.,How does AI convert a PDF's content into flashcards?,It uses Optical Character Recognition (OCR) to read the text and then extracts key information.,Why is a PDF often referred to as static content?,Because the content (text, layout, images) is typically fixed and not easily editable.
goodnotes-5,What is GoodNotes 5 primarily used for?,Digital note-taking, sketching, and PDF annotation on devices like the iPad.,Why is converting GoodNotes PDFs to flashcards beneficial?,It transforms passive notes into an active recall system, which is crucial for exam prep.,What feature in GoodNotes helps students organize their notes?,Notebooks, folders, and tags.
gre-magoosh,What is the primary goal of GRE vocabulary preparation?,To build a strong foundation of high-frequency words that appear on the GRE exam.,Define the Magoosh vocabulary word 'placid.',Calm and peaceful; not easily upset or excited.,How does an AI generator use GRE Magoosh materials?,It extracts the vocabulary word, definition, and context examples for instant card creation.
halloween,What celebration is Halloween traditionally linked to?,All Hallows' Eve, the night before All Saints' Day.,Name three common Halloween costumes.,Witch, ghost, vampire, superhero (any three).,What is "trick-or-treating"?,A customary practice for children to visit houses for treats on Halloween.
food,Name two types of protein-rich food.,Meat, fish, eggs, beans, nuts (any two).,What is the scientific term for sugar found in fruit?,Fructose.,What type of food is bread classified as?,A carbohydrate.
class-10-download,What is the main advantage of using AI for Class 10 study materials?,It quickly extracts complex concepts, formulas, and definitions from textbooks into study sets.,Why is active recall better than passive reading for Class 10 exams?,Active recall forces memory retrieval, leading to better retention of facts and formulas.,Name one subject typically studied in Class 10.,Math, Science, Social Science, or English.
fruits-vegetables,Is a tomato botanically a fruit or a vegetable?,A tomato is botanically a fruit because it develops from the flower's ovary and contains seeds.,Name a common root vegetable.,Carrot, potato, radish, turnip (any one).,What is the main source of Vitamin C in many fruits and vegetables?,Citrus fruits and bell peppers.
histology,What is histology the study of?,The microscopic structure of tissues.,Define 'epithelium.',A layer of cells that lines surfaces and cavities, acting as a protective barrier.,What are the four basic types of human tissue?,Epithelial, connective, muscular, and nervous tissue.
idioms,Define the idiom "break a leg.",A phrase used to wish someone good luck, especially before a performance.,What does the idiom "bite the bullet" mean?,To face a difficult or unpleasant situation with courage and fortitude.,Write a sentence using the idiom "to kill two birds with one stone.",I went to the store and picked up my dry cleaning, killing two birds with one stone.
abc,What is the first letter of the English alphabet?,A.,How many letters are in the English alphabet?,Twenty-six (26).,What are the two main categories of letters in the alphabet?,Vowels and Consonants.
flash-cards-pdf-free,What makes AI flashcards superior to static PDF notes?,AI converts static text into an interactive Q&A format, enabling active recall.,What is a primary benefit of using a free AI study tool?,It democratizes access to efficient study methods and saves students money.,How is a flashcard different from a summary sheet?,A flashcard is designed for quick, targeted recall, while a summary sheet provides broad topic overviews.
maker-download,Why do modern study tools prefer online generators over downloads?,Online generators are instantly accessible, always updated, and require no installation or local storage.,What is the primary function of a flashcard maker?,To convert existing study material (notes, PDFs) into structured flashcard sets.,What does "Smarter Studying" typically refer to?,Using evidence-based techniques like active recall and spaced repetition, often aided by technology.
fruits,Name three common tropical fruits.,Banana, mango, pineapple, kiwi (any three).,What fruit is known for its high potassium content?,Banana.,What is the protective outer layer of a fruit called?,The peel or rind.
multiplication,What is the result of 5 multiplied by 4?,Twenty (20).,Write the multiplication equation for "three groups of seven.",3 x 7 = 21.,If a box holds 6 pencils, how many pencils are in 3 boxes?,18 pencils (3 x 6 = 18).
ipa,What does IPA stand for in linguistics?,International Phonetic Alphabet.,What is the purpose of the IPA?,To provide a standardized and universal system for transcribing all sounds of human speech.,How does the IPA represent different vowel sounds?,With specific symbols that denote tongue position and lip rounding (e.g., /i/ vs. /u/).
integer,What is an integer?,A whole number (not a fraction or decimal) that can be positive, negative, or zero.,Is -5 an integer? Why or why not?,Yes, -5 is a negative whole number, which falls within the definition of an integer.,What is the absolute value of -10?,10.
phrasal-verbs,What is the meaning of the phrasal verb "look up"?,To search for information, typically in a book or online.,Break down the phrasal verb "turn off.",The verb is "turn," and the particle is "off." It means to stop a device.,Write a sentence using the phrasal verb "put off.",I had to put off my appointment until next week.
jolly-phonics-group-1,What five letter sounds are introduced in Jolly Phonics Group 1?,S, A, T, I, P, N (All six are usually introduced in Group 1).,What action is associated with the sound /s/?,"Waving your hand like a snake" or making an 'S' shape.,In Jolly Phonics, what is the 'blending' technique?,Running the sounds in a word together to read the whole word (e.g., c-a-t).
magoosh-vocabulary,Define the vocabulary word 'erudite.',Having or showing great knowledge or learning.,What does the word 'ephemeral' mean?,Lasting for a very short time; transient.,Give a synonym for the Magoosh word 'garrulous.',Talkative or excessively wordy.
make-quizlet,Why should students stop manually entering study content?,It is slow, repetitive, and often leads to errors that disrupt the learning process.,What is the benefit of AI-generated Quizlet-style flashcards?,Instant generation of structured Q&A pairs from existing study documents.,How does AI ensure the quality of generated study sets?,By analyzing the density of concepts and extracting only the most relevant definitions and terms.
marathi,What is "Namaskar" (नमस्कार) in Marathi?,A common greeting, meaning "hello" or "greetings.",What script is the Marathi language written in?,Devanagari script.,How do you say "thank you" in Marathi?,Dhanyawad (धन्यवाद).
nasm,What does NASM stand for in fitness certification?,National Academy of Sports Medicine.,What is the NASM's primary training model?,The Optimum Performance Training (OPT™) model.,What is the purpose of the overhead squat assessment (OHSA)?,To dynamically assess a client's posture, movement patterns, and muscle imbalances.
make-anki-fast,What is the key difference between manually making Anki cards and using AI?,AI processes the entire document in seconds; manual creation is a slow, card-by-card effort.,How does AI ensure the speed of Anki card creation?,It instantly structures the extracted data into Anki's specific field requirements.,What are 'Cloze Deletions' in Anki?,A note type that allows you to hide specific words within a sentence for testing recall.
