slug,question_1,answer_1,question_2,answer_2,question_3,answer_3
birds,Name three characteristics that most birds share.,Feathers, wings, lay eggs, warm-blooded (any three).,What is the term for a bird's feathers used for flight?,Flight feathers (or remiges).,What type of bird cannot fly and is native to Antarctica?,Penguin.
anki-medical,Why is AI better than manual decks for Anki Medical preparation?,It handles the massive volume of medical content quickly and accurately.,What is the primary challenge in studying medical knowledge?,The sheer volume of complex information that requires long-term memorization.,How does automated recall training benefit medical students?,It ensures high-yield facts are systematically reviewed using the spaced repetition curve.
blend,What is the definition of a letter blend?,A cluster of two or three consonants in a word where the individual sound of each letter is still heard.,Give an example of a word with the 'fr' blend.,Frog, free, frame (Any valid word).,How do AI flashcards assist in mastering letter blends?,They provide targeted practice on the phonetic combination of the letters.
pre-primer-sight,What are Pre-Primer Sight Words?,The set of the easiest, most basic high-frequency words that children should learn to recognize instantly.,Give two examples of Pre-Primer Sight Words.,A, and, away, big, blue, can, come (any two).,Why are these words taught before formal phonics rules?,Because they are common and often do not follow simple phonetic patterns.
online-vocabulary,How does an AI tool create perfect online vocabulary flashcards?,It ensures the extracted definition is concise and provides relevant example sentences.,Why is manual creation difficult for online vocabulary flashcards?,It requires looking up each word, typing the definition, and ensuring consistent formatting.,What is the benefit of using AI for online vocabulary review?,It accelerates exposure to new words and integrates them into a systematic review cycle.
create-quiz-quizlet,How does AI simplify the process of creating a quiz from study material?,It automatically extracts the Q&A data, which can then be formatted into a quiz instantly.,What is the main advantage of using AI over manual Quizlet creation?,It saves the effort of typing and formatting questions, allowing immediate focus on testing.,What kind of questions are best suited for flashcard-based quizzes?,Recall questions testing specific facts, definitions, or dates.
create-online,What is the advantage of creating flashcards online for free with AI?,Zero cost and instant access to sophisticated automation features.,How does AI ensure the quality of free online flashcards?,It uses advanced text analysis to generate accurate and relevant questions.,Why is Active Recall essential for effective learning?,It forces the brain to retrieve information, strengthening neural pathways for memory.
plants,What is photosynthesis?,The process by which plants use sunlight, water, and carbon dioxide to create food (glucose) and oxygen.,Name the two main parts of a plant's reproductive system.,Stamen (male) and Pistil/Carpel (female).,What is the purpose of a plant's roots?,To anchor the plant and absorb water and nutrients from the soil.
insect,Name three characteristics common to most insects.,Three body sections (head, thorax, abdomen), six legs, and usually two pairs of wings.,What are the three body sections of an insect?,Head, Thorax, and Abdomen.,What is the protective outer layer of an insect called?,Exoskeleton.
lowercase-letter,What is a lowercase letter?,The small form of a letter, used for general text (e.g., 'a', 'b', 'c').,How does learning lowercase letters differ from uppercase?,Lowercase letters are used more frequently in text and require different visual recognition.,Give an example of a lowercase letter.,a, b, c, d, e (any one).
quizlet-test-maker,How does an AI Quizlet Test Maker alternative benefit students?,It rapidly generates testable content from source documents without the need for manual Quizlet data entry.,What is the primary function of a test maker?,To produce practice questions in various formats (multiple-choice, fill-in-the-blank) for self-assessment.,Why is active recall testing superior to passive review?,Testing forces memory retrieval, which solidifies long-term retention.
prefixes-suffixes,What is a prefix?,A letter or group of letters added to the beginning of a word to change its meaning (e.g., 'un-').,What is a suffix?,A letter or group of letters added to the end of a word to change its meaning or function (e.g., '-ing').,What does the prefix 'pre-' mean?,Before.
alphabet,How many letters are in the English alphabet?,26.,What is the term for a letter that is not a vowel?,Consonant.,How does AI create Alphabet Flash Cards from images or PDFs?,It uses OCR to recognize the letters and structures them into individual cards for practice.
pronouns,What is a pronoun?,A word that takes the place of a noun (e.g., he, she, it, they).,Give an example of a subject pronoun.,I, you, he, she, it, we, they (any one).,What type of pronoun refers back to the subject (e.g., "myself")?,Reflexive pronoun.
blank,Why is manually making "blank flash cards from PDFs" inefficient?,It requires tedious copying and pasting of text onto a template or blank digital card.,How does AI eliminate the need for blank flash cards?,It automatically populates the question and answer fields from the source document.,What is the main benefit of eliminating manual effort in flashcard creation?,Students gain more time for active studying and revision.
long-vowel,What is a 'long vowel' sound?,A vowel sound that sounds like the letter's name (e.g., the 'a' in 'cake').,Give an example of a word with a long 'I' sound.,Bike, time, light (Any valid word).,What spelling rule often indicates a long vowel sound in CVCe words?,The silent 'e' at the end of the word.
high-frequency,What are High Frequency Words?,Words that appear very often in written text (e.g., "the," "is," "was").,Why is instant recognition of high frequency words important?,It increases reading speed and fluency, as the reader doesn't need to decode them.,Give two examples of high frequency words.,The, is, and, was, said (any two).
write,How does using AI change the way students "write flashcards"?,Instead of physically writing, they upload notes and the AI instantly generates the content.,What is the benefit of AI precision when writing flashcards?,It ensures conciseness and accurate extraction of key facts.,Why is the traditional method of writing flashcards sometimes slow?,It involves the time-consuming physical act of writing or typing each card manually.
zoo-phonics,What is the primary teaching method of Zoo Phonics?,Using animal names and corresponding body movements to teach letter sounds and shapes.,What is the sound associated with the animal 'Alligator' in Zoo Phonics?,The short 'a' sound /a/.,How do AI flash cards assist with Zoo Phonics learning?,They provide rapid, visual testing of the animal-sound-letter associations.
automatic-maker,What is the defining characteristic of an Automatic Flashcard Maker?,It converts raw input (documents, text) into structured study aids without manual intervention.,What does automation allow students to focus on?,Active recall, practice, and comprehension, rather than preparation.,How does the automatic maker handle different document structures?,It uses NLP to identify terms, definitions, and headers, regardless of formatting complexity.
kaplan-gre-vocabulary,Define the Kaplan GRE word 'alacrity.',Brisk and cheerful readiness; eagerness.,What does the vocabulary word 'delineate' mean?,To describe or portray something precisely.,Why are AI-generated flashcards better than traditional GRE study methods?,They instantly structure the high-volume Kaplan content into a testable format.
medstudy-pediatrics-download,What is the typical use for MedStudy Pediatrics PDFs?,Board preparation and maintenance of certification for pediatric specialists.,Why is Active Recall superior for pediatrics content?,Pediatrics requires memorization of vast amounts of differential diagnoses and clinical guidelines.,What is the focus of MedStudy Pediatrics material?,High-yield clinical information relevant to practice and exams.
ap-chemistry,What is stoichiometry?,The relationship between the relative quantities of substances taking part in a reaction.,Define 'enthalpy.',A thermodynamic property of a system equivalent to the system's internal energy plus the product of pressure and volume.,What does the acronym 'VSEPR' stand for?,Valence Shell Electron Pair Repulsion theory.
create-vocabulary,What is the first step when using AI to create vocabulary flashcards?,Providing the AI with the source list of words or a document containing them.,How does AI ensure effective vocabulary acquisition?,It pairs the word with a concise definition and often context sentences for better retention.,Why is AI essential for modern vocabulary creation?,It eliminates the need to manually search for and type definitions for every word.
barrons-sat-vocabulary,Define the Barron's SAT word 'laconic.',Using very few words; concise.,What does the term 'mendacious' mean?,Not telling the truth; lying.,How does AI aid in mastering Barron's SAT Vocabulary?,It quickly extracts and formats the extensive word lists into testable flashcard sets.
creator-images,How does an AI Flashcard Creator with Images function?,It extracts text from notes, creates the flashcard text, and then finds a relevant image to attach.,Why are images important in flashcards?,They engage visual memory, creating a stronger, dual-encoded memory trace.,What type of content benefits most from image inclusion?,Anatomy, history, vocabulary, and scientific concepts.
comptia,What does CompTIA stand for?,Computing Technology Industry Association.,What is the purpose of the CompTIA A+ certification?,To validate foundation-level knowledge of computer hardware and software, and troubleshooting skills.,Name one domain covered in the CompTIA A+ exam.,Hardware, Networking, Operating Systems, or Security.
abacus,What is an abacus used for?,Performing arithmetic calculations by sliding counters along rods or wires.,What is the name for the beads in the upper deck of a typical abacus?,Heaven beads or upper beads.,What is the name for the beads in the lower deck of a typical abacus?,Earth beads or lower beads.
nccer-pipefitter,What does NCCER stand for?,National Center for Construction Education and Research.,What is the primary function of a pipefitter?,To install, assemble, fabricate, maintain, and repair mechanical piping systems.,What is the purpose of the NCCER Pipefitter certification?,To verify core knowledge and skills in the trade.
ged,What does GED stand for?,General Educational Development.,What is the purpose of the GED test?,To certify that an individual has high school-level academic skills.,Name one subject covered by the GED exam.,Reasoning Through Language Arts, Mathematical Reasoning, Social Studies, or Science.
maker-studying,What makes an AI tool the 'Best Flashcard Maker for Studying'?,Its focus on efficient creation coupled with features that support active review (like SRS).,How does AI benefit the studying process beyond simple card creation?,It organizes, categorizes, and provides tools for testing the generated content.,Why is active recall emphasized when using a flashcard maker?,It shifts the mental effort to retrieval, which greatly improves long-term memory.
online,What is the primary benefit of using Free Notecards Online?,Accessibility from anywhere and the elimination of physical material costs.,How does AI enhance the efficiency of free online notecards?,By instantly converting complex documents into usable study aids.,What is the main goal of leveraging AI for high-efficiency learning?,To maximize the time spent on effective review rather than preparation.
make-my,How does AI allow a student to 'Effortlessly Make Your Own Flashcards'?,By automating the text extraction and formatting from any uploaded document.,What is the core benefit of AI over manual flashcard creation?,Speed and reduction of error-prone, repetitive tasks.,Why is it important to go beyond manual creation with AI?,To efficiently handle the large volumes of study material common in higher education.
shape,Name the three primary dimensions of geometric shapes.,Length, width, and height (or depth).,What is a two-dimensional shape?,A shape that has length and width but no depth (e.g., a square, triangle).,What is the sum of the angles in any triangle?,180 degrees.
maker-software,What is the main advantage of using AI Flash Card Maker Software?,It provides advanced features like OCR, NLP, and SRS integration in a dedicated application.,How does the software improve mastery of study workflow?,By seamlessly moving from document input to structured, scheduled review.,Why use AI software over simple manual entry?,For high-volume academic material, the automation saves hundreds of hours of labor.
emotions,Define the emotion 'anxiety.',A feeling of worry, nervousness, or unease, typically about an imminent event or something with an uncertain outcome.,What is the opposite emotion of 'fear'?,Courage or confidence.,Name three common facial expressions associated with emotions.,Smiling (joy), frowning (sadness), wide eyes (surprise).
dolch-sight,What is the Dolch Sight Word List?,A list of 220 high-frequency words that should be recognized instantly by early readers.,What is the main purpose of the Dolch list?,To provide a foundation of words necessary for reading fluency in early education.,Give two examples of words from the Dolch list.,The, a, is, was, said (any two).
alphabet-letter,What is the difference between an alphabet letter and a phoneme?,A letter is the written symbol; a phoneme is the sound it represents.,How many vowels are represented by alphabet letters in English?,Five (A, E, I, O, U).,How does AI assist in creating Alphabet Letter Cards?,It extracts and isolates individual letters for targeted recognition practice.
fraction,What are the two parts of a fraction called?,Numerator (top number) and Denominator (bottom number).,What does the denominator represent?,The total number of equal parts the whole is divided into.,Convert the fraction 1/2 into a decimal.,0.5.
money,What is the basic unit of currency in the United States?,Dollar.,Name three common coins used in the US.,Penny, nickel, dime, quarter (any three).,What is the term for the paper form of money?,Banknote or bill.
make-my-quizlet,How does AI speed up the process to "Make Your Own Quizlet Faster"?,By automatically structuring the Q&A from notes into the required Quizlet format.,What is the key benefit of stopping manual entry for Quizlet sets?,Increased time for actual active review using the generated sets.,Why does our AI outpace traditional Quizlet creation?,It eliminates the slow, repetitive task of typing and formatting individual cards.
letter-sound,What is a letter sound?,The specific sound or phoneme associated with a written letter (e.g., 'b' says /b/).,Why are letter sound cards important for early literacy?,They teach phoneme-grapheme correspondence, which is crucial for decoding words.,How does AI generation help with letter sound cards?,It rapidly produces clear, consistent cards for all letters and their sounds.
esl-weather,Name three types of severe weather.,Tornado, hurricane, blizzard, thunderstorm (any three).,What is the term for water falling from the sky?,Precipitation.,How do you say "It is sunny" in English?,It is a sunny day, or the sun is shining.
create-quizlet-quiz,What is the advantage of using AI to create Quizlet Quiz material?,It instantly provides the content (Q&A) required for various Quizlet quiz modes.,How does AI transform the way you create Quizlet Quiz content?,It automates the content population, allowing immediate focus on setting quiz parameters.,What type of information is ideal for a Quizlet Quiz?,Definitions, dates, short facts, and vocabulary.
sat-vocab,Why is AI essential for SAT Vocab acquisition?,It instantly creates massive, systematic, and targeted study sets from official prep materials.,Define the SAT vocab word 'parsimonious.',Excessively unwilling to spend money or use resources; stingy.,What is the benefit of studying SAT vocab with flashcards?,It enforces rapid, confident recall, necessary for quick comprehension on the exam.
families,What is a 'word family'?,A group of words that share the same root or a common pattern, such as the same ending rime (e.g., -at).,Give three examples of words in the '-an' family.,Can, fan, man, ran, pan (any three).,How do AI flashcards assist in mastering word families?,They group words by shared phonetic patterns for systematic practice.
addition-subtraction,What is the result of 5 + 3?,Eight (8).,What is the result of 10 - 4?,Six (6).,What are the two basic arithmetic operations studied first?,Addition and Subtraction.
singular-plural,Give the plural form of the noun 'cat.',Cats.,What is the plural form of the irregular noun 'child'?,Children.,What rule typically governs singular-to-plural conversion in English?,Adding an -s to the singular form.
cursive,What is cursive writing?,A style of writing where the letters are joined together in a flowing manner.,Why are cursive flashcards still used in some education systems?,To practice handwriting fluency and letter connection.,What is the opposite of cursive writing?,Print or block lettering.
addition,What is the result of 2 plus 7?,Nine (9).,In the equation 5 + 4 = 9, what is the number 9 called?,The sum.,What is the property that states the order of addition doesn't matter (e.g., 2+3 = 3+2)?,Commutative Property.
quiz-maker,What is the function of an AI Flashcard Quiz Maker?,To generate both the underlying flashcard data and various quiz formats from that data.,How does the maker unlock smarter studying?,By automating test creation, forcing the student into active testing rather than passive review.,What type of question is easy for a quiz maker to generate from flashcard data?,Multiple-choice and fill-in-the-blank questions.
phonics-sound,What is a phonics sound card?,A study aid that pairs a letter or letter group with the sound it makes (e.g., 'a' = /a/).,How does AI automate the creation of phonics sound cards?,It extracts phonetic data and formats it for visual and auditory practice.,What is the primary goal of teaching phonics sound cards?,To help students decode unknown words by sounding them out.
notes,What are 'Flash Card Notes'?,The concise, extracted pieces of information from a longer document that form the basis of a flashcard.,How does AI convert documents into 'Flash Card Notes'?,It uses NLP to identify the essential terms, definitions, and facts.,Why is mastering study efficiency important for students?,It allows them to cover more material with better retention in less time.
ai-generator,What is the core technology behind an AI Flashcards Generator?,Natural Language Processing (NLP) and Machine Learning (ML).,Why is it smarter to use an AI Generator than to study harder?,AI automates the laborious prep work, ensuring time is spent on high-impact active recall.,What input format does the AI generator primarily use?,PDFs, documents, or raw text input.
community-signs,Name three common community signs.,Stop sign, yield sign, crosswalk sign, speed limit sign (any three).,What color is a typical warning sign?,Yellow or fluorescent green.,What does a "yield" sign instruct a driver to do?,Slow down and stop if necessary to allow other traffic to pass.
opposite,What is the opposite of 'hot'?,Cold.,What is the opposite of 'up'?,Down.,Give an example of an antonym pair.,Big/Small, Happy/Sad.
short-vowel,What is a 'short vowel' sound?,The sound of a vowel that is not its name (e.g., the 'a' in 'cat').,Give an example of a word with the short 'O' sound.,Dog, pot, hop (Any valid word).,Why is mastering short vowels crucial for early reading?,They are the most common vowel sounds encountered in CVC words.
color,Name the three secondary colors.,Green, orange, and purple (violet).,What is the complementary color of red?,Green.,How does AI help in creating Color Flash Cards from PDFs?,It extracts color names and related concepts (like color theory) from the document.
anki-medical-students,What is the main challenge medical students face with memory?,The rapid forgetting of vast amounts of detailed information.,How do smart study aids help medical students using Anki?,They automate the creation and management of large decks, optimizing the SRS schedule.,What key knowledge areas require extensive flashcard study in medicine?,Anatomy, Pharmacology, and Pathology.
action-picture,How do action picture study cards aid memory?,They link the abstract concept (the action) to a concrete visual image, aiding recall.,What type of learner benefits most from action picture cards?,Visual learners and young children acquiring new vocabulary.,Give an example of an action often depicted on a card.,Running, jumping, eating, sleeping.
action-verb,What is the definition of an action verb?,A verb that expresses a physical or mental action.,What question does an action verb answer?,What is the subject doing?,Give a mental action verb example.,Think, dream, realize, believe.
create-multiple-choice,How does AI create Multiple Choice Flashcards?,It extracts the correct answer and generates plausible, but incorrect, distractors from the source material.,What is the benefit of studying with multiple-choice flashcards?,It prepares students for the format of standardized tests, testing recognition skills.,Why is AI essential for multiple-choice creation?,Manually writing accurate distractors is difficult and time-consuming.
convert-notes,What is the primary benefit of converting notes to flashcards?,It shifts the learning process from passive reading to active, testable retrieval.,What technology does AI use when you convert notes to flashcards?,Natural Language Processing (NLP) to understand the context of the notes.,Why is AI the future when you convert notes to flashcards?,It instantly performs the task that used to take hours of manual effort.
pdf-flashcards,What is the main function of an AI PDF to Flashcards converter?,To read unstructured PDF text and structure it into concise question/answer pairs.,Why is PDF conversion a critical study tool?,Most academic and professional materials are shared in PDF format.,How does AI ensure content accuracy from a PDF?,It analyzes font changes, bolding, and section breaks to identify key terms.
maker-from,What is the primary benefit of an AI Flashcard Maker *from PDF*?,It turns dense, read-only documents into active, testable study material.,How does the AI maker achieve deeper retention?,By focusing the generated cards on core concepts that require active recall.,What type of information is extracted by the maker from a PDF?,Definitions, formulas, dates, and names.
exercise,Name three common physical exercises.,Running, swimming, lifting weights, cycling (any three).,What is the difference between aerobic and anaerobic exercise?,Aerobic uses oxygen for energy (long duration); anaerobic does not (short, intense bursts).,What is the benefit of regular exercise?,Improved cardiovascular health, muscle strength, and mood.
program-make,What is the core function of a 'Program to Make Flashcards'?,To provide a streamlined, automated process for turning notes into reviewable study decks.,How does AI enhance the making program?,It drastically accelerates content generation and formatting.,Why does this program outperform manual flashcard creation?,It removes the time-sink of typing and structuring every single card.
fruit-vegetable,Is a cucumber botanically a fruit or a vegetable?,A cucumber is botanically a fruit because it develops from the flower and contains seeds.,Name one leafy green vegetable.,Spinach, kale, lettuce (any one).,What is the common culinary distinction between a fruit and a vegetable?,Fruits are typically sweet; vegetables are savory.
fruit,What is the purpose of the seeds inside a fruit?,To facilitate plant reproduction.,Name a fruit that is high in Vitamin C.,Orange, strawberry, kiwi, lemon (any one).,What is the botanical definition of a fruit?,The mature ovary of a flowering plant, usually containing seeds.
70-phonograms,What is a phonogram?,A symbol representing a sound or sounds of speech; often a letter or combination of letters.,What is the purpose of mastering the 70 phonograms?,To improve reading and spelling skills by recognizing consistent sound patterns.,Give an example of a multi-letter phonogram.,Sh, ch, th, er, or (any one).
synonyms-antonyms,What is a synonym?,A word or phrase that means exactly or nearly the same as another word or phrase.,What is an antonym?,A word opposite in meaning to another.,Give a synonym for 'large.',Big, huge, enormous.
adjectives-opposites,What is the opposite adjective for 'loud'?,Quiet or silent.,What is the opposite adjective for 'easy'?,Difficult or hard.,How do AI flashcards assist in mastering adjective opposites?,They present pairs of words, forcing contrastive recall for better memory.
grammar-adults,Define the grammatical term 'gerund.',A form of a verb that acts as a noun (e.g., 'swimming' in "Swimming is fun").,What is the purpose of a semicolon?,To separate two independent clauses that are closely related in meaning.,Explain the function of the passive voice.,The subject receives the action, rather than performing it (e.g., "The ball was thrown").
animals-kindergarten,What sound does a cow make?,Moo.,Name an animal that can fly.,Bird, bat, bee (any one).,What animal is known for having stripes?,Zebra or tiger.
